Ken Griffey Sr & Ken Griffey Jr hit back to back home runs. First father/son duo to hit home runs in the same game.,aniipv,Jaredrap,34563,0.93,1
Philadelphia Phillies' Nick Williams insane slide on first career stolen base,6ymfik,BunyipPouch,34499,0.92,0
The Skycam angle of Cordarrelle Patterson's 102 yard TD return,dkto8g,Yu-Yu-Hakusho-is-Lit,34473,0.94,1
Braden Holtby's Game 2 save...in cartoon flipbook form (OC),8nsz9w,theflippist,34413,0.88,0
One of the greatest sports bloopers of all time,5cdlop,Maxim435,34283,0.92,0
Pole Vault Gone Wrong,6s61hi,Rawalmond73,34286,0.93,0
Conor Mcgregor enters The Matrix.,et7vv8,Sofargonept2,34274,0.85,3
Mets pitcher Steven Matz catches a line drive behind the back and gets the double play,9h6gvy,gangbangkang,34270,0.94,0
Forsberg beats him like a rented mule.,8bwfh5,IrishBeardsAreRed,34232,0.92,0
Redeemed himself on missing that first dunk even though the basket didn't count,5o4vn3,GallowBoob,34233,0.77,0
Hilarious sign at NBC's Stanley Cup Finals Pregame Show,8opswy,BunyipPouch,34164,0.91,0
Rays IF Will Ryhmes faints from Pain after Hit By Pitch on Forearm,8hy2pl,SeattleMana,34153,0.92,0
Oddly satisfying and oddly accidental slo-mo of my friends not so great golf game.,bccwtq,arpan171,34149,0.92,0
"Tens of thousands of Belgians agreed to do an ""AdFundum"" (finish their beer in 1 go) every time Neymar falls down during the WorldCup match Brazil-Belgium tonight.",8wjhuo,Lorenzvc,34150,0.92,0
Amazing hockey play,5njc50,Zero2176,34143,0.92,0
Usain Bolt's face right before he finishes the 100 meter sprint in the semi-finals in Rio,4xqz7j,jcarmona24,34120,0.89,0
Football wonderkid,68sbbr,loda970,34129,0.88,0
Bill Murray...An American Treasure,apar12,thatsapeachhun,34041,0.92,1
Roy Jones Jr used to toy with his opponents In the ring while knocking them out,7wfef5,Hash43,34035,0.9,0
'Beat the Freeze' race gives fan a generous head start,ccu48c,ariverra,33896,0.89,0
Kid does some skateboarding tricks.,9k7pe2,Keychain33,33875,0.91,0
The NCAA will allow athletes to be compensated for their names images and likenesses in a major shift for the organization,dotgha,jjlew080,33834,0.94,1
Ballboy's Awesome Catch,6ar1z4,BunyipPouch,33814,0.9,0
Andrew Whitworth of the LA Rams who has been playing in the NFL since 2006 but his teams have been 0-7 in the playoffs celebrates with his children after getting his first playoff win,afm14j,TooShiftyForYou,33780,0.92,0
What 10000 horsepower does to a top fuel drag tire at launch.,83ciw1,Whitlow14,33757,0.95,0
Crazy goal in the KHL,5zcuqk,iBleeedorange,33763,0.9,0
The ref looks REALLY happy that the Patriots scored a touchdown.,7s10jv,Atrampoline,33747,0.74,0
Yuliya Levchenko - high jump for 1.96 (PB at European Championship U23),6onr3j,jenana__,33729,0.9,0
Alex Ovechkin lifts the Stanley Cup for the first time in his career!,8pgmhd,TwoPlanksPrevail,33727,0.86,0
Cleveland Browns field goal attempt to get their first win in 2 years,9egjzt,TooShiftyForYou,33727,0.91,0
Back to back splits... on TV,9smey9,survivorbuffs_,33721,0.93,0
Tip off fake out,6ecj0f,Whoshabooboo,33694,0.88,0
Today is the 25th anniversary of Jose Canseco having a ball bounce off his noggin for a home run.,8ma60i,daves_not__here,33683,0.94,0
MMA fighter gets the KO victory then tears his ACL while celebrating,9z6vrr,TooShiftyForYou,33610,0.92,0
Downhill Ice Cross,7m0ya2,_Ryanite_,33574,0.91,0
Kawhi Leonard is Able to Dunk and Palm the Ball Before It Hits the Floor,9pgw2j,Meatprint,33573,0.9,0
Coach communicating with his team during a timeout (Mississippi School for Deaf),9wkusa,SanduskysSecrets,33543,0.93,1
Eagles Defender Avonte Maddox taunts Packers TE Allen Lazard after the play. Lazard shows him the flag.,dbbjbw,caindaddy,33510,0.91,0
The Buffalo Bills are back into the NFL playoffs after 17 years of not qualifying. Their fans are tailgating appropriately.,7os6c3,LAZYTOWWWWWN,33451,0.85,0
To referee a Lions game you need something extra...,6f11w7,Charredcheese,33430,0.87,0
Gonzaga basketball players and the news anchor who interviewed them.,620u88,marsmedia,33360,0.89,0
These two guys adjusting their hats during last nights game 7.,7ad9zt,arthritictongue,33316,0.85,0
Ichiro Suzuki Recives a Round of Applause and Farewell from His Teammates as He is Taken Out in His Last Career Game,b3qc1d,Meatprint,33307,0.94,1
A winning manager showing his father the trophy his county received for winning the All Ireland for the first time in 29 years,6yvcqh,Hurling001,33286,0.9,0
Vegas Golden Knight's Game-Opening Ceremony Against the Winnipeg Jets for the NHL Playoffs,8k3d8o,BunyipPouch,33257,0.91,0
Calgary Hitmen fans celebrate opening goal by throwing stuffed animals onto the ice to be donated to deserving children this Christmas.,7j2unv,TooShiftyForYou,33258,0.94,0
Ball boy baits Cristiano Ronaldo,6r3zvu,,33246,0.88,0
Dear ESPN go fuck yourself. Sincerely everyone.,3pomaw,,33181,0.85,0
Messi scores his first goal in world cup 2018 vs Nigeria.,8u2ehk,dist23special,33179,0.85,1
"(World Cup) Reporter to Lionel Messi [in Spanish]: ""After the 1st game I gave you a good-luck amulet that my wife gave me. I don't know if you still have it or threw it away..."" Messi then shows he's worn it along along and leaves the reporter stunned.",8u7nxu,WYKWTS,33063,0.91,1
Insane flying knee knockout,8lj6ps,treetuba8,33004,0.9,0
Russell Westbrook offers to trade a young fan his shoe for a slice of pizza,9scy0o,TooShiftyForYou,32949,0.93,0
Always show good sportsmanship,6gif3z,iBleeedorange,32805,0.89,0
Canelo Alvarez with a lightning fast counter punch,69pksc,Hash43,32772,0.91,0
Super Bowl: CBS rejects ad on benefits of medical marijuana,aimvi8,Chachmaster3000,32703,0.89,1
The power of a Mike Tyson right hook in his prime,6ekbfn,Whoshabooboo,32704,0.91,0
After four runs Canada and Germany tie for gold in the men's two man bobsled. The teams tied to the hundredth of a second.,7ymxzg,too_drunk_for_this,32638,0.94,0
25 years ago today one-handed pitcher Jim Abbott threw a no-hitter.,9d2zze,Whoshabooboo,32631,0.93,0
The Chicago Cubs are heading to the World Series for the first time since 1945.,58wnxr,lilkdabastard,32552,0.73,0
I wrote to ESPN in 1994 in a 7th grade writing class. This was what i got in response.,da8mo7,Defvac2,32525,0.95,2
LA Raiders linebacker Matt Millen punching former New England Patriots general GM Patrick Sullivan after the 1985 divisional-round playoff where the Patriots pulled off a upset 27-20. Millen was apparently not happy with Sullivan's trash talking of Howie Long during the game.,ayqeo6,virtuallEeverywhere,32498,0.93,0
Kobe's first point ever... And his last,4etdim,Maverickx25,32460,0.84,0
That time Shaq made everyone on the bench fear for their lives,57zvf3,ObjectiveAgent,32433,0.91,0
Soccer ball interrupts a military parade marching through the Red Square in Moscow,8v9811,PrecariouslySane,32409,0.91,0
The number 9 appears in cloud form over Nissan Stadium as the late Steve McNair’s #9 jersey is retired as a Tennessee Titan.,d4ou7x,benny_feld,32385,0.9,0
Logo for 2018 World chess championship were released today. Somebody messed up big time.,7ktqb7,saurabhk51,32383,0.87,0
Betty Heidler’s incredible hammer throw,cdqex8,BritDSTattoos,32375,0.9,0
William Karlsson of the Vegas Golden Knights made an unassisted shorthanded between-the-legs goal,88opur,TooShiftyForYou,32365,0.93,0
Philippe Gilbert falls over a wall in Tour de France,91hjti,VesilahdenVerajilla,32331,0.93,0
My school has an app that syncs your phone flashlight with our light show. Pretty neat,a3jf5k,roguespectre67,32324,0.91,0
High school kicker Levi Forrest smashes 59-yard field goal,dhtfzp,arzani,32305,0.93,0
"Golden Tate drops ""The People's Elbow"" on the football after scoring a TD",76kyii,TooShiftyForYou,32291,0.87,0
NFL Star Running Back Lesean McCoy alegedly beat up his girlfriend Delicia,8xqn1e,brooklyn-_-nets,32260,0.81,0
Nike jerseys not off to a great start,7988en,GuacamoleFanatic,32247,0.93,0
Mattie Rogers attempts a 106kg (233.7lb) snatch at the 2019 World Weightlifting Championships,dyucbb,RespectMyAuthoriteh,32240,0.92,0
NFL referee gets caught in the middle of a dogpile,7guxz6,SeattleMana,32241,0.92,1
A young fan dressed as an umpire and called a Minor League game from the stands,8j3u30,BunyipPouch,32199,0.88,0
Awesome sportsmanship from Mike McDade,c088e8,GlobalSweet,32120,0.95,1
When you drive like a madman better have good reflexes,6jdfhd,Nergaal,32096,0.92,0
7’ 3” Boban Marjanović standing next to 4’ 11” Kristen Chenoweth,a7z6vh,dreamteamreddit,32002,0.89,0
Phil Mickelson takes golf advice from young fan before attempting shot out of the rough.,6yhysx,que_xopa,31985,0.9,0
Boban Marjanovic of the LA Clippers came to wish actress and singer Kristin Chenoweth good luck with the national anthem before tonight's game,9sth6n,TooShiftyForYou,31933,0.92,0
fuck you ESPN,3k5o95,Fartboi,31906,0.89,0
No big deal.,5firij,ZGrizZly,31875,0.91,0
Cowboys 325lb G Larry Allen chases down 250lb linebacker to prevent touchdown,7g4a6z,SeattleMana,31866,0.93,0
World Cup: England in semi final,8wu371,rchresta,31838,0.86,0
The University of Minnesota put a picture of a gopher up on the jumbo tron during Penn State's Field Goal kick.,du4miy,mcpat21,31823,0.92,4
Cyclist Robert Förstermann legs,ebgfn0,schinken091,31804,0.93,2
Impressive leap,8600j6,hn_ns,31789,0.94,0
Surprise: Mexico beats Germany 1 : 0!,8rs9sa,rchresta,31758,0.84,1
"When a Miami Hurricane football player makes an interception or recovers a fumble they are immediately given a massive gold chain to wear called ""The Turnover Chain.""",73buum,EZ_does_it,31754,0.86,0
A story of revenge,5frfy2,thebigsexy1,31737,0.77,0
Cubs Win 2016 world series!!,5auvwo,MossyOak1500,31729,0.68,0
Cristiano Ronaldo amazing bicycle kick goal vs Juventus,89hzf5,ThatEnglishKid,31716,0.86,1
Catching an interception on your butt,7lwxau,jcarmona24,31709,0.88,0
Insane Frisbee Catch,6abzsa,BunyipPouch,31677,0.86,0
Tim Duncan is so smooth,6slwai,,31650,0.87,0
Franck Ribéry unties the referee's shoes,6tefov,unknown_human,31600,0.91,0
Young fan at Yankees game snags a foul ball with a glove full of popcorn,8eyzc6,TooShiftyForYou,31531,0.93,0
Why NASCAR pit crew wear firesuits,9lcdi4,caindaddy,31454,0.93,0
"Jordan Mailata a 6'8"" 346 pound Samoan rugby league player who has never played football got drafted in the 7th round by the Philadelphia Eagles",8fnj3f,TooShiftyForYou,31403,0.94,0
Indonesian soccer player Terens Puhiri has incredible speed,78ofjh,TooShiftyForYou,31399,0.92,0
Oops,5dhg3i,10gauge,31374,0.88,0
On this date in 1998 Bobby Boucher showed up at halftime and the Mud Dogs won the Bourbon Bowl.,7b7ebm,Atraxx_Gaming,31373,0.88,0
[Hockey]Guy wrecks himself leaving the ice,5ny2va,MJDTA,31360,0.86,0
Sound guy gets destroyed by the team entering the stadium (Vikings),5e3svk,GallowBoob,31305,0.84,0
Leo Messi's impressive shirts collection,6b6sd9,jromeit,31269,0.79,0
President Obama ends Olympic ‘victory tax’. The IRS will now be prohibited from taxing most medals or other prizes awarded to U.S. Olympians.,56tge7,jay_bro,31252,0.78,0
When skydiving in Australia the danger comes after you land.,dfe4gr,MinutePhrase,31215,0.93,0
Polish skier Pawel Babicki finishes run on one ski,7nnigr,TooShiftyForYou,31149,0.93,0
Puerto Rico just won its first ever Olympic Gold medal by 22yo Monica Puig in the Ladies Tennis Singles final. She beat Angelique Kerber of Germany (2016 Australian Open Champion). She (Puig) is unseeded in the tournament while Kerber is No.2 seed and ranked No.2 in the world,4xlgau,amgtech86,31147,0.87,0
"""Fucking ridiculous"" thought Tony Ferguson as he practiced his salsa dancing with RDA",7b588g,vik1980,31063,0.88,0
A Japanese runner broke her leg during a relay race yet she didn't stop and crawled to her partner so the team would be able to continue the race,9w8pw2,Visardist,31035,0.93,0
Scoring From First Base On A Single,6m31sy,TooShiftyForYou,31036,0.87,0
Carlos Gómez gets hit with a tranquilizer,94pmn8,Scaulbylausis,30964,0.93,0
Toronto Is In Town,57rpbb,Scar3crow_x,30938,0.85,0
Muhammad Ali 'The Greatest of All Time' Dead at 74,4mgr2u,Fernmelder,30939,0.8,0
Brazilian surfer Rodrigo Koxa surfing the largest wave ever ridden topping out at 80ft,97eh30,dickfromaccounting,30923,0.94,0
T.J. Lee requests a Wide Reciever then gets a train run on him,9q6n49,Sawavin,30840,0.92,0
Beer League Softball at bat,6rhz3s,Whoshabooboo,30832,0.89,0
Embiid celebrates with Kevin Hart. Then proceeds to pick him up like a little boy.,8eqwpi,EZ_does_it,30830,0.92,0
After Bucs start 2-0 normally modest Ryan Fitzpatrick shows up to press conference dripping in gold and diamond jewelry with dark sunglasses on and says: “We have to stay humble. We can’t change who we are.”,9gk1sm,ledenutgrafkicker,30803,0.91,0
Scene from Zagreb & London at same time.,8y78jw,cinephile46,30768,0.91,0
Norwegians play drunk football,5eisre,grizzzzly_94,30768,0.83,0
Just over three months after the bus crash that killed 16 hockey players in Saskatchewan survivor Ryan Straschnitzki (left) who suffered a spinal injury is practicing sledge hockey. He hopes to one day participate in the Paralympic Games.,912nym,gangbangkang,30745,0.93,0
Burnley F.C. fan brushes off a header,984j7t,TooShiftyForYou,30699,0.93,0
The compression of this ball on a homerun,77asjb,WillieB87,30594,0.89,0
Footballer finds an alternative way of transportation,6jh93a,Krimaj,30602,0.91,0
This is what happens when you spend too much time on the bench (North Carolina Tar Heels),5cxj16,GallowBoob,30592,0.8,0
19 year old João Félix of Benfica celebrating with his 16 year old brother who is a ballboy at the game.,bdjm9m,theAlat,30478,0.94,2
Steward bodychecks runner at 2017 UCI Road World Championships,71c546,CoreySteel,30428,0.93,0
Edson Barboza KOs Beneil Dariush with a perfectly timed flying knee at UFC Fight Night 106,a1j76b,conez420,30405,0.9,0
Messi showing off his shirt to Real Madrid fans after 3-2 goal in El Clasico. Probably the pic of the day.,6758dd,jromeit,30363,0.8,0
World Champion Irish boxer Michael Conlan shows judges the finger after controversial loss to Russian,4y06lg,TnaG67,30337,0.88,0
In his first game freshman Brandon Talton University of Nevada's backup kicker drills a 56-yard field goal with no time left to give his team the win over Purdue,cxshwq,suzukigun4life,30274,0.94,1
Ravens 340lb DT Brandon Williams doing a handstand,7g0uev,SeattleMana,30241,0.9,0
Messi dodging 4 defenders and scoring,6pwn9l,,30185,0.9,0
Manny Pacquiao's devastating knockout against Ricky Hatton,8r0te5,unknown_human,30178,0.9,0
Cyclist Janez Brajkovic leg after a race,dgbxuh,timetodine13,30107,0.84,0
Neymar with a great rainbow flick Vs Costa Rica,8t1k0d,wrdb2007,30030,0.84,0
Baby Ducks found on Fowl Line during Baseball Game,8hoihi,SeattleMana,30013,0.93,0
March Madness summed up in one photo,8596o8,brooklyn-_-nets,30009,0.85,0
View from the announcer's booth in the fog during the Patriots vs. Falcons game,787r4t,TooShiftyForYou,29975,0.91,0
USA and Mexico players with a much needed message.,5ciaaf,Frankocean2,29962,0.74,0
Don't pick a fight with the goalie,5ttcjn,TooShiftyForYou,29898,0.9,0
Come For Baker Mayfield's First TD Pass Stay For The Fusion Dance Celebration,9ka7w6,MattadorD,29824,0.93,0
Devonte Green has the GTA: San Andreas unlimited ammo cheat code tatted on him because he’s a shooter,b4t8sz,Iciyy,29830,0.94,0
When you dunk on Shaq…,5mwwx4,WallyForPM,29822,0.92,0
This sign seen on college game day.,dx94bc,TitaniumTacos,29778,0.9,2
"The Japanese Sport ""Bring the pole down""",7pngdp,smullen40,29775,0.94,0
US Women's Soccer Star Carli Lloyd makes a 55-yard Field Goal during Philadelphia Eagles practice,cui9v5,caindaddy,29772,0.89,0
Pittsburgh Pirates' Josh Harrison Reaches 2nd Base Uniquely,6ca6cb,BunyipPouch,29758,0.87,0
George Best what a man,5or6wt,The-Blayster,29706,0.8,0
Happy New Year to everyone,5l9ddg,DzejBee,29700,0.88,0
51-point underdog The Citadel produced the longest rushing touchdown Alabama has given up to any team since 2015,9xzh90,TooShiftyForYou,29693,0.89,1
Euro Training,4zthoi,middleeastnewsman,29638,0.88,0
Milwaukee's Matthew Dellavedova steals rolling inbound pass to beat the buzzer,8e64uv,TooShiftyForYou,29622,0.93,0
Gold medal-winning U.S. Olympic men’s curling team throwing the first pitch at the Twins home opener,8ac9ua,iam_nobody,29625,0.94,0
"Shaq making the 6'6"" 270 lbs Rob Gronkowski look like a kid on his shoulders",b5g2pq,candidateHundred,29612,0.92,0
#50 with the assist of the game,b1tg98,Chinmusic415,29606,0.9,0
Roger Federer Defeats Marin Cilic to Win Record-Tying Sixth Australian Open Now Has 20 Grand Slams Overall,7tjswq,yesh222,29554,0.89,0
Odell Beckham Jr. plays catch with a young fan,9a2bxg,ciocanmihai,29541,0.93,0
How to put spin on the cue ball,8mlcle,tristan10000,29524,0.94,0
[Yates] The potential #1 pick in the NFL draft was suspended for accepting a loan - that he paid back in full - from a family friend. The potential #1 pick in the NBA draft was ruled ineligible because his coach helped his family move while in HS. Another banner day for the NCAA.,dtni64,BrownsAndCavs,29525,0.91,0
CONGRATULATIONS Dutch women’s football team for making it to the world cup finals!,c8zsr5,jangeest,29516,0.86,1
Since the World Cup begins today I created an animation with the flags of the qualifying countries.,8r3fgz,bobafederline,29512,0.91,0
Got Em,4x3lc7,Doriando707,29484,0.91,0
Referee gets injured in Belgian cup match gets replaced by guy from the crowd. Luc Bosmans got the chance to be linesman in a match with 2 clubs of the Belgian first division. He did not make any mistakes and even stepped in to calm the players in some incidents,7gp88i,dickfromaccounting,29479,0.95,0
Eli Manning gets tackled by...nobody.,71057d,PowerOf10,29389,0.81,0
One of the most vicious flagrant fouls you'll ever see,83h6x0,probusyradio,29358,0.89,0
Senegal manager Aliou Cissé's celebration when his team scored,8sacp5,wrdb2007,29368,0.93,1
Boban Marjanović plays keep away with Anthony Davis,8b8dxm,TooShiftyForYou,29358,0.93,0
Marc-André ter Stegen comes up huge with two sets of back to back saves in the same game,cf6j1w,Mcgoozen,29351,0.94,0
Don't try to pick a fight with the goalie,8p1ljw,jesuspunk,29290,0.92,0
Tiger went downhill Fast.,6e273t,plutosrain,29213,0.88,0
Powerlifter Jessica Buettner nails a 231.5kg (510.37lbs) deadlift at a recent competition a new Canadian record for her weight class.,bwwaq8,RespectMyAuthoriteh,29201,0.91,0
Julian Edelman gives Super Bowl tickets to 7th grade girl who was bullied for playing football as her team's quarterback,alrecl,Hope_Burns_Bright,29152,0.87,0
Mayor of Nashville Knows How To Make America Great Again,6fj9lb,OmahaSlim715,29126,0.83,0
Getting out of the bunker,6dlpzc,iBleeedorange,29033,0.89,0
Minnesota Twins Outfielder Byron Buxton makes leaping catch at the wall,6bb3t2,BunyipPouch,28998,0.89,0
Maybe don't shove your coach though,781hb5,GuacamoleFanatic,28972,0.91,0
Never celebrate too early,4v6fg4,3yronF1ve,28976,0.86,0
Iowa State band brought out T-Rexes for the halftime show,9o455r,gangbangkang,28947,0.84,1
Pretty great team work!,5gmkop,Zero2176,28941,0.85,0
Novak Djokovic Becomes First Tennis Player in History to Win All Four Slams and All Nine Masters,98o3m7,nolesfan2011,28911,0.93,0
Michael Jordan's satisfying fadeaway shot,6y7jbn,Bektic,28904,0.87,0
Nadal can get to any ball on clay,egmfvb,iBleeedorange,28880,0.96,1
Fake pick-off attempt works in American Legion Championship game last night,99d73l,caindaddy,28862,0.94,0
Maurizio Sarri tries to substitute Kepa Arrizabalaga for Willy Caballero but Kepa refuses to come off and Sarri is absolutely furious!,aubbcc,hn_ns,28848,0.9,1
Titans 321-pound offensive lineman Dennis Kelly catches a touchdown pass becoming the heaviest player in NFL history to catch a touchdown pass in the playoffs,er2fni,suzukigun4life,28853,0.93,0
Marathon Speed ​​Experience,djo3v2,KokioEnglish,28825,0.95,0
Aaron Donald stops the read option by tackling both the quarterback and running back at the same time,elnygb,IHaveABigCaucus,28814,0.96,1
McGregor finishes Cerrone in the first round of his return,eqseo2,IHaveABigCaucus,28807,0.89,1
Bowling pin defies gravity,9vmtac,survivorbuffs_,28785,0.91,0
49ers WR Dante Pettis whips out the Thriller Dance after a touchdown on Halloween,dpyl3z,Yu-Yu-Hakusho-is-Lit,28748,0.9,1
How to celebrate a goal in style,7vw8ur,rossyboy_123,28744,0.94,0
Sportsmanship.,9ygxkh,CormacZissou,28635,0.92,0
First of all,bq4mm0,EmAlkaline,28623,0.91,0
Michigan State's Matt McQuaid turns his own blocked shot into a buzzer-beating three,85dv11,TooShiftyForYou,28565,0.93,0
"This dude got it 6'2"" and legit free throw line.",4lk6y9,GallowBoob,28554,0.8,0
Tennis great John McEnroe throws one of the best ceremonial first pitches ever,4w0enc,Mandinga33,28547,0.88,0
Gotta give it to the San Jose Sharks for this towel design. Amazing,8cz9fv,rideandrock,28541,0.94,0
Legally blind High School wrestler wins the Alabama state championship,arqp5t,TooShiftyForYou,28467,0.93,1
NBA draft suits--2003 vs 2017,8twz5b,beachdogs,28466,0.88,0
Andrew Jones the Texans Longhorns guard that was diagnosed with Leukemia is still getting buckets!,7w0ruy,IGbotter,28431,0.88,0
Albert Almora Jr. accidentally hit a 4 year old girl in the stands with a hard hit foul ball. This is him after being told by a park security guard that the little girl will be okay.,but0bx,Reacher-Said-Nothing,28429,0.96,0
Fan about to take the ceremonial first touch goes and scores for his team instead,72qmxo,Pirate_Redbeard,28404,0.91,0
Bolt having a serious moment pre-race,4yq7w4,iBleeedorange,28357,0.83,0
some superbly executed synchonised drop n' role.,8dx59m,DavidBHAFC,28313,0.92,0
McGregor about the Mayweather fight,6x629m,Iamglennn,28316,0.88,0
World Cup: Croatia beats Russia by penalties and moves to the semi-finals,8ww8nd,rchresta,28304,0.92,0
Kobe Bryant dies in heli crash,eubd51,LastCallForBeer,29481,0.95,6
Jacare Souza blasts Chris Weidman and tries to show enough restraint for the ref to stop the fight.,a6jvgg,Stonefree2011,28274,0.92,1
Perfect Motorcycle Turn,6j11jn,BunyipPouch,28281,0.89,0
Dereck Lewis KO’s Alexander Volkov in UFC 229 proceeds to give the best speech in UFC history,9m25on,heemboi,28249,0.89,0
Kevin Kisners caddie never misses leg day.,60bdj7,lopro19,28214,0.89,0
Rod Salka pounds his chest then instantly pays for his bravado at the hands of Danny Garcia,7x9iw8,Tom_Cody,28189,0.94,0
Hockey kid makes a friend on the visiting team,7ifccm,TooShiftyForYou,28183,0.93,0
In a league of his own,53xuzr,Apostjustforthis,28188,0.84,0
Rutgers offensive lineman celebrates a touchdown by punching his quarterback in the head,d7dqeq,Fear_Jaire,28144,0.95,0
One year after losing 19 of its players in a plane crash Brazilian club Chapecoense clinched qualification to the Copa Libertadores—the South American Champions League,7hiwm7,TooShiftyForYou,28137,0.94,0
Insane pass from South African rugby player Dillyn Leyds,64920c,Sheepy_10,28127,0.86,0
Chicago Cubs' Javier Baez Slides Smoothly Into Third Base,bmz2ts,BunyipPouch,28115,0.93,0
Aerial Photo of the B2 Stealth Bomber Flyover at the 2018 Rose Bowl Game,7nk9l8,Cornelius_Poindexter,28113,0.91,0
LeBron James’s response to criticism for not speaking out on human rights issue: “I don’t think every issue should be everyone’s problem.”,difamf,genericreddit0r,28095,0.92,1
Celtics' Kyrie Irving surprises a Cavaliers fan,7a2t82,BunyipPouch,28065,0.92,0
Jarvis Landry Pro Bowl Dodgeball King,etkgek,zebulonworkshops,28058,0.94,0
Roof Closing at the Mercedes-Benz Stadium in Atlanta,6qve8d,BunyipPouch,28046,0.88,0
Olympics provide the simple pleasures in life,4wjcqp,Grunge_bob,27993,0.87,0
Bristol City manager Lee Johnson celebrates a last minute wining goal vs Man Utd with a young ball boy,7l4ugd,ImOldGreggML,27994,0.93,0
Lacrosse goalie makes a save with his hand after the whistle blows,c8nh6n,TheOtherSparrow,27912,0.92,0
Mississippi State wins it at the buzzer to end UConn's win streak of 111 games,62qk6f,preme1017,27891,0.82,0
Soccer used to have different rules,5jxve6,Donald_Keyman,27864,0.91,0
BYU mascot just stole all your ladies,9mb52a,azgrunt,27865,0.82,0
Tiger's winning moment in all five Masters!,bg7ftj,eafrog,27847,0.91,1
Epic matchpoint in crazy sport,6w5aws,LDRandID,27837,0.91,0
David Beckham's free kick against Greece which secured England's qualification for the 2002 World Cup,7o2d01,unknown_human,27829,0.9,0
TCU Basketball surprises a walk-on player with a scholarship,ages1b,TooShiftyForYou,27796,0.96,1
Changing 5 wheels in 3.3 seconds,6kq2ds,BunyipPouch,27802,0.92,0
Mallex Smith stolen base cycle against the Rangers,bugnv9,iam_nobody,27694,0.95,1
Senegal player sends a shot over the goal and into the stands. Shirtless Japan fan heads it away.,8tiz98,prolikewhoa,27662,0.94,0
Hockey player turns stick into a javelin for the most incredible shootout goal,5rpc3a,jordansw,27633,0.9,0
Jack Nicklaus paying tribute to his buddy Arnold Palmer this morning to open the Master's,63uzgv,mungoflago,27502,0.9,0
Fun fact: Did you know that when Sweden and Denmark play each other in FIFA WC the letters that are used for the teams are SWE vs DEN (together Sweden) and the remaining letters which are not used are DEN and MARK (together Denmark),8s1a1m,Brocky445,27502,0.81,0
Tricking the opponent,85lero,Botatitsbest,27495,0.95,0
Caballero's (Argentina goalkeeper) costly mistake.,8sutbt,cakebeerandmorebeer,27501,0.92,0
Goalkeeper's ghost pass. Hilarious!,7be5b4,crassina,27474,0.88,1
"""hey now. if it works it works""",5kpenh,enelprinceofthemoon,27468,0.87,0
