Greg Popovich conducts a vote on whether to let Patty Mills keep playing while in foul trouble.,839937,Scaulbylausis,49359,0.89,0
This is how you start a fight,5r1j59,Heisenberg5ever,49362,0.89,0
Muhammad Ali Dodges 21 Punches In 10 Seconds,9ppwhv,hotshot1738,49254,0.85,1
Vance MacDonald with one of my favorite stiff arms I’ve seen in a long time.,9inlgv,Getuhm,49154,0.89,0
True Sportmanship,74917d,TheINTL,49118,0.9,0
The #1 Bracket on ESPN “I just guessed”.,86nxre,BowTiedWonder,49024,0.9,0
Football commentators are crazy!,7t40pj,nickmw,48893,0.87,2
Joey Bosa of the Los Angeles Chargers meets with Tom Brady,agp0z5,TooShiftyForYou,48659,0.92,1
I mean you could've just asked for it...,6d81eb,Pirate_Redbeard,48577,0.92,0
Von Miller flagged for unsportsmanlike conduct.,72cju1,TooShiftyForYou,48535,0.91,0
Chicago's Chase Daniel was eager to start his first game since 2014 and ran onto the field too early,9zhem8,TooShiftyForYou,48454,0.91,1
A young Colorado Rockies fan caught a Washington home run and a young Washington Nationals fan caught a Colorado home run. So they swapped souvenirs.,8cklmx,akick31,48425,0.92,1
NY Yankees Aaron Judge plays catch with a young fan in between innings.,8ua2lg,TooShiftyForYou,48406,0.92,0
Usain Bolt scores his first professional goal for the Central Coast Mariners,9nj4zk,Nivoryy,48334,0.94,0
The longest ski jump ever (832 ft),b2pdim,Heercamelot,48287,0.94,1
91 Year Old Gymnast's Routine,6i336m,ThatsMyHoverboard,48246,0.87,0
Japanese baseball superstar Shohei Otani crushes a fly ball through a 2 foot gap in the roof,5ctbei,MundaneInternetGuy,48213,0.92,0
The curve on that shot!,9od7un,,48055,0.9,0
Polish club match turns into the battle of Hogwarts,9w5sry,NewFound_Fury,47926,0.89,0
Seattle NHL team names as voted on by Reddit,a3cubk,SeattleMana,47887,0.91,4
Wholesome figure skating moment by Yuzuru Hanyu,7yr3g0,JermaineColeslaw,47734,0.89,0
"37 years ago today a bunch of college kids from USA defeated USSR in ""Miracle on Ice"".",5viq0w,Sol1tary,47710,0.84,0
Never forget that 2001 MLB game where Randy Johnson killed a bird,7gad64,,47692,0.88,0
Fan with poster gets her wish,6qh83a,BunyipPouch,47672,0.9,0
MMA Fighter perfectly times opponents spinning attack with a spinning elbow of his own,9p92bi,halalchampion,47416,0.92,0
Water jousting,9nu7gd,dickfromaccounting,47393,0.92,0
Old school,73h5c5,QuincyDental,47397,0.86,0
Man asks Blue Jays for the source of injury news and the Jays respond quite literally.,b9sn19,shel6,47367,0.94,0
Bend it like Adriana Leon,7pv78z,Botatitsbest,47310,0.78,0
Pablo Cuevas' no-look behind the back Tennis winner,6bve1m,BunyipPouch,47307,0.92,1
Ohio State band does The Space Race,de2zym,el_monstruo,47219,0.91,1
Shaun Murphy snooker trick shot,66py5j,,47171,0.88,0
Amazing throw in Ultimate Frisbee game,9kge3w,dickfromaccounting,46958,0.9,0
Tying Shoes Penalty Kick,65ju56,BunyipPouch,46929,0.87,0
College basketball player gets injured but still scores,7f1b1a,dickfromaccounting,46911,0.81,0
Young fan made the most of his ceremonial kick-off in Marseille.,9aql34,gangbangkang,46817,0.87,0
Calculated Drift,66vh7r,NicoRosbot,46733,0.91,0
Alabama brought in helicopters to help dry the field for today's Iron Bowl,9zzsnx,TooShiftyForYou,46698,0.88,0
Crossing a Triple Jump lane during a competition,62zf9e,wayl,46624,0.85,0
Steph Curry inspires a new generation,7hx1n0,dreamteamreddit,46604,0.88,0
"Hopkins lacrosse executes a perfect ""hidden ball trick"" to score against Navy.",8mhrsh,KalaStubbs,46582,0.87,0
LeBron's dance at the playoffs finals.,8q8st6,Pot_Puree,46519,0.85,1
Perfect turns by F1 Driver Kimi Raikkonen,6duav5,BunyipPouch,46360,0.9,0
Paul Hunt's entertaining gymnastics routine,7uurza,dickfromaccounting,46145,0.85,0
Wide Receiver trying to beat his defender in rock-paper-scissors,ac6ne1,TooShiftyForYou,46037,0.88,0
Naomi Osaka wins Australian Open. She is the first Japanese player (man or woman) in history to earn World #1 ranking,ak022h,nolesfan2011,45934,0.92,0
Italy has failed to qualify for the FIFA World Cup for the first time since 1958.,7cqju6,MrFlow,45895,0.89,0
Steph Curry desperately trying to get open,7i6nzb,dreamteamreddit,45895,0.9,2
Eight months after suffering a spinal injury during a game Steelers LB Ryan Shazier is walking on his own,94k2dy,gangbangkang,45801,0.9,0
Zverev scares ball boy,9myeqk,Tucko29,45491,0.95,0
F1 driver Riccardo Patrese takes his wife for a drive on the track,8ekwvh,dickfromaccounting,45480,0.89,0
Deontay Wilder extends his jab then strips Kelvin Price's guard to land his KO right,71it9g,Tom_Cody,45339,0.91,0
Extremely talented amateur boxer does backflip mid fight,am3yzz,Hash43,45332,0.72,1
F1 pit stops are so fast these days.,8cvnaa,WarlockOPain77,45315,0.92,0
Heartbreak in Chicago: K Parkey Misses Potential Game Winner Against the Defending Champions,adc36l,Yu-Yu-Hakusho-is-Lit,45221,0.85,2
The Chosen One,5rf2oi,Niropid,45139,0.91,0
Iceland a country with the population of 330.000 just qualified for the World cup!,75c4tf,JollyNinjaMan,45079,0.91,0
Soccer On Ice,6lvi6a,BunyipPouch,45065,0.9,0
Ronnie O'Sullivan with impossibly precise spin to get back onto the red,878np4,thisisnotdavid,45021,0.93,0
This is our best friend Nicholas Dworet he was a swimmer and a 2020 Swedish Olympic hopeful. He passed at Marjory Stoneman Douglas please never forget,7xum78,access249,44944,0.84,2
Wayne Rooney celebrates scoring against Manchester City 4 years apart.,6v7due,IrishSweatPatch,44897,0.87,0
Incredible save during this weekend's MotoGP 3,8ksqzi,Fuego710,44837,0.93,0
Dancer at a basketball game makes a half court shot by lobbing it backwards,62fc9g,iBleeedorange,44727,0.88,0
Michael Jordan's competitiveness never ends,6rc1as,,44721,0.86,0
Kansas City's Patrick Mahomes looks to his right while throwing to his left,a4y4i8,TooShiftyForYou,44709,0.9,1
Ryan Williams Lands BMX 1080 Front Flip at Nitro World Games,8m7bv5,BunyipPouch,44610,0.9,0
Watch out Curry.,68nemu,c01dz3ra,44541,0.83,0
Turning one point into three,8bqmjn,Scaulbylausis,44522,0.91,0
Dallas Mavericks Luka Doncic got left hanging and high fived himself,a5q05u,TooShiftyForYou,44519,0.92,1
"""Go Deep!""",a27b2f,Fawked,44472,0.92,1
Feeling a rookies's heartbeat before his debut,695smf,Whoshabooboo,44410,0.93,0
Today would’ve been legendary SportsCenter host Stuart Scott’s 53rd birthday. Cooler than the other side of the pillow happy birthday Stuart.,907b0k,doth_thou_even_hoist,44371,0.85,0
The most insane cornhole shot I've ever seen,cbnn49,-_Illusion-_,44351,0.88,0
LSU's Breiden Fehoko doing a traditional Haka war dance with his father and brother before the Georgia game this Saturday,9ojlye,UmangB,44270,0.87,2
Jeremy Lamb half court buzzer beater to beat Toronto,b53syu,ItsTreDay,44209,0.93,2
Norwegian curling team's Valentine's Day pants.,7xhw8z,h4ha,44172,0.93,0
Conor McGregor punches elderly man for turning down his whiskey.,cqnxop,loveisland15,44124,0.91,2
Michael Phelps is the most decorated Olympian of all time and also holds the record for the longest televised putt,btamwb,creehiker16,44113,0.94,0
Japanese rookie Shohei Ohtani hits first major league home run.,89ne4c,Botatitsbest,44093,0.95,1
Adam Hadwin reads the green,81uele,TooShiftyForYou,44065,0.94,0
Soccer player gets a lucky break and has a decent chance to score...,7594v4,No_Therapy,43544,0.91,0
J.J. Watt takes the field in Houston for the first time since Hurricane Harvey,6z9m68,JF_112,43541,0.77,0
"""Give him a yellow card.""",7c0vfx,Ghost_Animator,43494,0.91,0
Dirk Nowitzki showing his soccer skills,9a87kh,nassunnova,43486,0.9,0
Did this woman standing next to Putin steal a gold medal from the World Cup?!,8z5eeb,ffsCrow,43480,0.85,0
Army went with all white uniforms for their game with Navy. They became perfect snow camouflage.,7ir293,est2020,43471,0.91,0
Amazing full-court buzzer beater,7kks9f,,43361,0.9,0
In case anyone wanted the Pittsburg Penguins wifi info,6a2pui,SQUIRTnCIDER,43186,0.9,0
Peters throws flag into stands,7hcgju,roshe789,43148,0.88,0
Regular people attempting to jump as high as Cristiano Ronaldo,6jkxy6,,43124,0.9,0
Michael Jordan shatters the backboard with a dunk,6llm6t,,43022,0.9,0
German Bobsled Team Crashes Into 1st Place,7yj7rr,djkeithers,42942,0.91,0
Wisconsin high school drains half court shot at the buzzer!,aqsbve,ThMaF23,42589,0.88,0
Mbappe High fiving the intruder during FIFA final,8z9wup,cloud_weather,42523,0.89,0
Catcher Joe Mauer fakes a throw to first base before racing to home plate to tag out Brett Gardner,8jbo1l,JF_112,42477,0.91,0
The body of an elite NFL athlete,5lnna2,goalie_monkey,42451,0.8,0
Prolific scorer Leo Messi had been unable to get a goal past legendary keeper Gianluigi Buffon until finally this past Tuesday. Here they are after the match.,702ye8,ruh_roh_shaggy,42429,0.88,0
LeBron James surprises the assistant equipment manager for the Grizzles with his game worn shoes after the win in Memphis,a4kwv9,commonvanilla,42370,0.89,1
Rally car driver shows off some skill,65g5dr,LordStanley22,42232,0.87,0
Deaf and blind Brazil fan experiences the World Cup,8tqt2g,TooShiftyForYou,42200,0.9,1
Claude Giroux goes between the legs and lifts a defender's stick to beat a 4-on-1,aamy8c,TooShiftyForYou,42164,0.9,2
Former Australian Prime Minister Bob Hawke skulling a beer on live TV at the cricket,7o7qtv,dogzfan,42057,0.9,0
Akiem Hicks taunts Andrew Luck in Pro Bowl Dodgeball and gets nailed,ajra4n,TooShiftyForYou,42044,0.91,0
How to stop Messi.,5yn01e,CykaIdaNaHui,42005,0.89,0
USA wins the 2019 FIFA Women's World Cup over the Netherlands 2-0,ca8z7z,caindaddy,41900,0.8,2
Patriots defense save the punt,a7aef6,Fluff_E,41839,0.9,0
You think paying to watch out of market games are bad? Wait til you have to pay for that plus in market games. JOIN THE FIGHT.,7est42,karvus89,41778,0.79,0
Snake on the field watches baseball game,8ixme1,TooShiftyForYou,41767,0.92,0
Joe Mauer using his spidey senses to catch a ball,8ec7xz,SeattleMana,41657,0.91,0
Bethe Correia eats a shin bone sandwich after taunting The Preachers Daughter Holly Holm at UFC Fight Night 111,a9wiss,conez420,41650,0.89,1
The greatest game ending touchdown ever.,5jqjd8,Ghost_Animator,41587,0.78,0
Humboldt Broncos defenceman Logan Boulet has been taken off life support. His organs will be donated and he will help save the lives of six others. R.I.P. Logan,8at0bl,JF_112,41547,0.91,0
No-Look Knockout,69l372,BunyipPouch,41550,0.9,0
Titans fake punt goes for a 66-yard TD.,9gcj9c,TooShiftyForYou,41506,0.89,0
This man attended game 7 of the 1945 World Series seated behind home plate please help him find a photo of him at the game.,59caq5,,41367,0.83,0
Crazy double save by Evgeny Chernov in Russia Premier Liga,cyaswa,dickfromaccounting,41349,0.95,0
Dont forget japan,6vx6lp,cisforseagull,41325,0.89,0
Asking for a booking,5n6rlk,Jukehz,41223,0.88,0
Kicker wins full scholarship after he makes 53-yard field goal,6uhzut,BunyipPouch,41217,0.86,0
This guy at the eagles - packers game.,5fgolj,,41164,0.9,0
Tigers first baseman Miguel Cabrera used the hidden ball trick on Ehire Adrianza to get an out,azxo74,TooShiftyForYou,41145,0.92,0
Akwasi Frimpong Ghana's First Skeleton Athlete Enjoying PyeongChang,7xz39n,BunyipPouch,41126,0.89,0
Setting up for a penalty kick,5gtdvn,xMeta4x,41075,0.87,0
One of the best hockey goals I've ever seen,6qlw12,Gerzaloub,41068,0.91,0
Infield triple,6lrhxw,DrunkenEye,40994,0.92,0
The most intense dart player ever,6c57k9,JF_112,40974,0.86,0
Seamless team goal by the Red Wings,88agac,TooShiftyForYou,40972,0.91,0
Olimpic games 2018 by Vladimir Tsesler,7jiptx,behemotrakau,40915,0.85,0
Fancy flying while filming a rally car,60i3lt,Ayy_2_Brute,40846,0.92,0
Out of nowhere,6u22iw,,40848,0.9,0
Atlanta Braves fan makes an incredible one-handed catch of a Grand Slam home run during tonight's game.,bz5sbf,BunyipPouch,40822,0.93,2
Jose Guillen's mutant throw from the warning track,8d7607,SeattleMana,40818,0.94,0
Sidecar co-pilots hugging the corners at the Scarborough Gold Cup.,9cv8wv,PHIL-yes-PLZ,40715,0.94,0
Triple Cork 1980 from the x-games,7toqo0,lessons_learnt,40547,0.92,0
Roy Jones Jr takes a moment to think about how good he is.,68j8fc,blonders1,40412,0.91,0
Extreme downhill racing,6of0xq,_Ryanite_,40371,0.8,0
David Beckham pranked with a fake statue by James Corden.,b06g11,adxx12in,40352,0.85,0
Mertens & his imaginary friend (X-Post),7455nm,vik1980,40305,0.91,0
Houston Rockets honor 1-year anniversary of the passing of sideline reporter Craig Sager with tribute video and invited his 12 year-old daughter Riley to take a ceremonial shot,7kbeb1,TooShiftyForYou,40276,0.91,0
Auburn player is warmly welcomed into Georgia huddle.,5l4j93,SeattleMana,40261,0.92,0
Everyone was watching Chile's game yesterday EVERYONE (Taken from r/Chile),6k8npx,soloconstant,40172,0.88,0
Shaq could literally dunk on the whole team at once,9uq7al,Blackjack667,39973,0.93,0
Todd Helton gets an out on Matt Carpenter after he forgets to stay on the bag,7xnrh5,Scaulbylausis,39941,0.88,0
A Very Clever Field Goal Fake Just Barely Works,acwwgx,Yu-Yu-Hakusho-is-Lit,39902,0.92,2
Skipping in a 380ft shot - Eagle McMahon,8gheev,Jfonzy,39813,0.91,2
Impressive table tennis rally,6b0vc8,Ho_Phat,39739,0.89,0
French ice dancers Marie-Jade Lauriault and Romain Le Gac perform the rotational lift portion of their routine,7wxf5c,dickfromaccounting,39675,0.9,0
Windy day on the golf course,6gu2e1,iBleeedorange,39663,0.88,0
Philadelphia Eagles Beat New England Patriots 41-33 in the Superbowl 52,7vbury,colburp,39634,0.72,0
Guy gets trapped under tarp being put over raining Baseball field,8h4zvn,amont3s,39605,0.93,0
Rafael Nadal hits an unreal shot around the net to set up match point,cyz4du,Mtml58,39606,0.95,0
Shaq dunking on all 6 nets,aptmzf,alecp17,39586,0.93,2
"Conor McGregor: ""This guy lives at the back of the gym in a van. Respect to everyone chasing their dreams in this crazy world.""",6hz3n5,unknown_human,39562,0.86,0
Cody Zeller Misses the Free Throw and Steals the Ball from Giannis Who Forgot It was a Live Ball for an Easy Dunk,azdel5,Meatprint,39532,0.94,0
One punch knockout in shortest title fight in boxing history,7eantx,TooShiftyForYou,39537,0.85,0
Man U's Ibra elbows a player after his head is stepped on.,5xhiog,WhoDoneItNow,39399,0.88,0
Counterattacking team goal wins it late for Belgium,8vlqru,TooShiftyForYou,39377,0.9,0
Father gets emotional when his son scored goal first time,9ylj3q,58Josh,39154,0.89,0
Cyclist(Tomasz Marczyński) legs during the season,ci387h,Quaver30,39027,0.87,0
Man wearing a MAGA hat asks for LeBron's towel Bron throws it out of his reach,8kq65m,iBleeedorange,38926,0.66,0
Washington Wizards Fans All Feel The Pain Simultaneously,81qhct,BunyipPouch,38893,0.89,0
NFL lineman catches teammate for touchdown,52bsj6,Phallicmallet,38872,0.89,0
Fan gets picture with Cristiano Ronaldo before being escorted off the pitch,7qc46c,unknown_human,38863,0.88,0
Reds' Jesse Winker makes catch eyeballs fan's food.,bhg8yj,handlit33,38849,0.94,1
Eliud Kipchoge has broken the unofficial Marathon world record with a time of 1:59:40.2!,dgsb0t,Wordythings,38742,0.94,8
Jason Witten broke the Pro Bowl trophy while presenting it to Jamal Adams and Patrick Mahomes,akh4oc,TooShiftyForYou,38733,0.92,0
History could be made in San Francisco on Sunday: Blake Bortles needs 16966 rushing yards against the 49ers to become the NFL's all-time leading rusher (Emmitt Smith: 18355).,7lia61,IrwinRSchyster1,38702,0.8,0
Trevor Booker joins Cleveland's huddle.,78t3lh,Botatitsbest,38693,0.93,0
And with the first pick in the 2023 NHL Draft...,52rs1o,,38515,0.85,0
Jamal Adams makes the day of a fan.,9353zb,Plebsplease,38520,0.87,0
This corner kick today in the football game Paris SG vs Toulouse FC,6uyznq,kaphi,38402,0.92,0
Egyptian goalkeeper Mahmoud Gad With a clear and last-ditch effort save,d7p7b9,caindaddy,38371,0.95,1
"""You saw that...You saw that too""",576sj8,Papichulo666,38354,0.87,0
Calgary Flames goalie’s brother who has autism meets hero Harvey the Hound in heartwarming video.,ahisxd,Delsie_Metzler,38331,0.9,0
Grandpa puts on a boxing clinic.,6xk1d5,NightTrainDan,38205,0.86,0
They went right back to fighting after they both got out of the penalty box,8lpi40,iBleeedorange,38153,0.93,0
Mike Tyson's Unstoppable Right Hook & Uppercut Knockout Combination,961vhf,BunyipPouch,38076,0.93,0
Brothers First,7p972f,walkersfirst,38060,0.85,0
Baseball reporter catches foul ball in the middle of his segment,6xsr56,BunyipPouch,38006,0.93,0
Senegal's training session looks fun.,8tgz9d,NBLSS,37976,0.9,0
No-look shot at the World Badminton Championships,95ojvw,caindaddy,37873,0.9,0
Professional skiier Max Hauke gets caught in the act using performance enhancing drugs under the skiing world cup,avva68,Feagod,37820,0.91,0
Thanks NBC for letting me know Tiger is even (score-less) as he gets his clubs from his car in the parking lot,ajeo2d,theawkwardpumpkin,37763,0.91,0
Muhammad Ali boxing underwater 1961. Ali was 19 here and didn't know how to swim.,85sfmz,Onion_Do_Piaza,37760,0.88,0
playing tennis with a fireball,7w46e8,YongQing,37735,0.93,0
Chapecoense plane crash survivor scores in a friendly match,7mndt6,TooShiftyForYou,37716,0.89,0
USA Men's Curling wins Olympic gold for first time ever.,7zvjai,jbird221,37679,0.85,0
Rodney Mullen,8aj6ag,VlClOUSLY,37608,0.9,0
USA Beats Canada for Womens Hockey Gold Medal in Pyeongchang,7zd0gr,Commandant1,37592,0.78,0
Tim Duncan's daughter is wearing a Gregg Popovich T-shirt,9zo9tg,markhanna123,37543,0.9,0
Things Got Crazy In Badminton,5n263c,MagicWade,37523,0.92,1
Belgian players console and give a hand to Japanese players after their heartbreaking loss,8vrzfs,AlligatorAss,37436,0.91,0
Zion Williamson Recovers on Defense and Sends a Three Point Attempt into the Stands with a Block,aoz1e2,CaramelPhD,37325,0.93,1
Talgat Zhailauov has a rough time exiting the penalty box,8l2kk5,JF_112,37318,0.92,0
Tiger Woods wins his first PGA Tour victory since 2013. Finishes #1 at the Tour Championship,9iccci,HouseHeisenb3rg,37287,0.85,0
Shemika Charles limbo at half time game for Wisconsin. She's 23 here. At 18 yrs old she set the Guinness World record at 8.5 inches.,6gg6o5,iBleeedorange,37283,0.87,0
Bill aims at halting taxpayer-funded stadiums,6gziz8,getthetime,37237,0.93,0
Curtis Stevens reacts to Gennady Golovkin's left hook,9fhxyv,Tom_Cody,37133,0.93,0
Matt Damon and Jimmy Kimmel at the Boston Red Sox vs LA Dogders World Series game,9s8vej,Go_Habs_Go31,37065,0.81,0
Tampa Bay Ray’s pitcher Oliver Drake shows off his screwball,cfuphe,Mcgoozen,37050,0.95,0
Why you shouldn’t use your cell phone during a basketball game,7pljhw,Naweezy,37038,0.84,0
Giroud takes the ball pass 5 players including the keeper to score a goal,ad4zo5,boi_thats_my_yeet,36922,0.91,0
Learn to love your enemies,6nj38v,,36902,0.88,0
104-Year-Old World War II veteran Frank Anderson Threw Out a First Pitch Yesterday at a Memphis Red Birds Game,8w9jrj,BunyipPouch,36871,0.89,0
The Miami Dolphins Pull Off a Miracle 69 yd Lateral TD to Beat the Patriots!,a4ou6n,Meatprint,36871,0.86,1
The Toronto Raptors Parade From Above,c1qp7p,tiiiki,36808,0.91,0
Blake Griffin Fools Both Defenders with a Fake Handoff,b1nqb4,Yu-Yu-Hakusho-is-Lit,36789,0.94,0
Giannis Antetokounmpo gives a young fan his own hoodie to cover up a Big Baller Brand hoodie,7vfzru,TooShiftyForYou,36644,0.88,0
Bundesliga side Hoffenheim installed a giant screen at their training grounds to enable them work on mistakes in real time. The players have found a better use for it.,99y8ac,Darqseyd,36585,0.92,0
Toronto Raptors are the 2019 NBA Champions. Making it the first time a team not from the United States has won the NBA Championship.,c0fdko,Coffeetime18,36526,0.81,1
Brian Earhart - 391ft Ace at 2019 Glass Blown Open,bhy334,KcazOcrut,36528,0.93,1
Mets' Todd Frazier grabbed a fan's rubber baseball to fool umpires into thinking he'd made this catch.,9djkq2,caindaddy,36514,0.9,0
Jay Cutler posing as a threat at wide receiver in the wildcat formation,73t559,TooShiftyForYou,36501,0.83,0
Dwight Muhammad Qawi taunting Leon Spinks,bolykl,buffalozbrown,36419,0.94,1
Former Cowboys head coach Jimmy Johnson gets emotional as he receives word of his induction into the NFL Hall of Fame. Troy Aikman former Cowboys QB under Johnson also gets emotional watching.,enwxrj,Yu-Yu-Hakusho-is-Lit,36391,0.89,6
Christian & Scooby Halftime Performance Arizona Basketball,arle80,Neyo708,36379,0.88,1
UConn Coach putting on his professional face after beating Syracuse,9xlq3t,grosenthal25,36337,0.92,0
Tim Cameron's rock bouncer has a mind of its own.,9d8aah,PHIL-yes-PLZ,36341,0.93,0
Beautiful play by Marcelo and his helpers 😃,d2amch,frenchmadridista,36306,0.92,1
One shot to win her daughter free tuition,arew9l,themostextra,36254,0.9,0
Introducing Darrel 'The Barrel' Hales,7vkenj,dickfromaccounting,36227,0.85,0
Prospect demonstrates his confidence and slickness.,9xert6,Hash43,36213,0.91,0
Brutal Head Kick,7fv2de,Subtle_Omega,36202,0.89,0
Canelo with the head movement clinic,9e19b6,PM_me_your_pee_video,36152,0.93,0
Football coaches agreed to slide in the mud if the team had a good practice,9vgszr,TooShiftyForYou,36095,0.89,0
Triple front flip on skis,8bj1i1,rv1976,36084,0.92,0
Three brothers were on the starting squad for the New Zealand rugby team today.,8pticr,az9393,36058,0.91,0
Downhill Ice Skating,a0ap57,dickfromaccounting,36063,0.93,0
High school pitcher strikes out his childhood friend to go to the state championship and forgoes celebrating to console him.,8qanha,-EG-,36029,0.93,0
Cincinnati Reds 3rd Baseman Alex Blandino Shows Off Impressive 67-MPH Knuckleball During Pitching Debut,8ylk9s,BunyipPouch,35965,0.91,0
Pit stop in 2 seconds,7obiyx,icorrectotherpeople,35856,0.92,0
Shaun Murphy Trickshot vs Ronnie O'Sullivan,9r18k1,wrdb2007,35856,0.92,0
The worlds longest hockey game is currently being played in Norway. 9 periods of overtime and counting. Still tied 1-1. The game started over 7 hours ago.,5z1xa3,31415926510,35817,0.91,0
Houston Astros mascot tricks Angels' Mike Trout,66dw5b,BunyipPouch,35775,0.91,0
Lacross long shot,e00aip,aids_free_since_69,35720,0.92,1
Tennis Physics,8yx0p1,Morty_Goldman,35679,0.91,1
Drake sitting court-side at the Raptors Game wearing a Humboldt Broncos Jersey #humboldtstrong,8cb87h,yungshadowban,35658,0.8,0
LeBron James responds to Donald Trump rescinding Stephen Curry's invitation to the White House,71yxee,MiaCannons,35643,0.68,1
On this day two years ago Rougned Odor punched José Bautista and created my favorite photo in all of sports.,8jn7qa,SinfulSnorlax,35639,0.86,0
"Broadcast team having a little fun with a baseball player named ""Arquimedes""",ausdsb,Reacher-Said-Nothing,35632,0.92,0
Fan on the field taken out by defender,8rop8l,TooShiftyForYou,35586,0.91,0
P.K. Subban gets upset in the penalty box but is also a good guy about it,7zysey,dickfromaccounting,35584,0.92,0
Fighter dislocates shoulder.. opponent sets it back in place. Sportsmanship.,6srl8q,,35573,0.89,0
Trick shot,83ktnz,Botatitsbest,35407,0.93,0
Warren Moon throwing perfect spirals.,aewiow,TragicDonut,35352,0.92,1
New York Ranger’s Pavel Buchnevich makes a kid with his old KHL jersey cry by giving him a stick and taking a picture with him,84ie4m,CantYandleTheHeat,35266,0.93,0
Bills fans waited in single digit temperatures to welcome the team home after making the playoffs for the first time since 1999.,7nfchj,Natetendo83,35264,0.87,1
Wow congrats Joe Thomas!,6w2e2h,Shigs__,35215,0.91,0
Odell Beckham One-Handed Catch,6tni5f,TooShiftyForYou,35191,0.84,0
Giannis with an amazing pass to Harden's face,aef35k,TeaBagginton,35199,0.94,0
Cleveland Indians Pitcher Zach McAllister Making the Catch of the Year,8c362l,BunyipPouch,35162,0.81,0
Happy Halloween from the RCR Pit Crew Department!,9t17hw,RCRreddit,35081,0.91,2
The perfect free-kick,59nezj,eclanucx,34990,0.88,0
13 y/o Oleksii SEREDA has become the youngest gold medalist ever in the history of the diving European Championships,cp7cfv,Stas9t,34987,0.94,0
Dirk Nowitzki attempts a bicycle kick in a charity game,bnh8q0,hn_ns,34927,0.94,0
Highlight of the Marlins’ season,d75g3p,sczcarlos,34856,0.96,1
Ridiculous footwork from Anthony Martial,6p9ryg,conman1112,34853,0.87,0
Football coach runs through the locker room door during pregame speech,9nobtn,TooShiftyForYou,34800,0.9,0
Two young fans enjoying the view at the Broncos game,9ahahx,gangbangkang,34792,0.9,0
This Day 20 Years Ago: Mark McGwire hits #70. Phil Ozersky a fan making $30K a year catches the ball. The Cardinals ask him for the ball for a signed bat ball & jersey. Ozersky says he also wants to meet McGwire. McGwire says no. 3 months later Ozersky sells ball for $3.05M.,9jcj8b,IAmClaytonBigsby,34786,0.92,0
Ravens QB Lamar Jackson spins past two defenders on a long TD run,dugdpl,Yu-Yu-Hakusho-is-Lit,34766,0.93,0
For the first time in NCAA tournament history a 16 seed has beat a 1 seed. UMBC (16) beats Virginia (1) 74 to 54,8518cm,iBleeedorange,34767,0.85,1
German foreign Office release wholesome travel advisory for Germans in Canada after amazing semi-final victory,7zqme4,Ashrok,34759,0.92,0
Leo Messi nutmegs Filipe Luis,a0q0gy,trebleszn,34697,0.92,0
Crazy rally in a 'Spikeball' match a sport that was featured on Shark Tank and gained popularity.,9b1m02,caindaddy,34666,0.88,0
Young Shaq brings down the hoop,67edzg,Whoshabooboo,34655,0.92,0
Cate Campbell of Australia gets annoyed that she broke the Commonwealth Games Record in the 100m Freestyle Semifinal. She's annoyed because breaking a Games Record automatically triggers a drug test.,8apkn3,SinusVenarum,34625,0.87,0
This penalty made me smile,cshhm8,Jonkooo,34609,0.93,1
