Weightlifter promised his wife to win an Olympic gold medal before she died in a car accident,7k6zaz,unknown_human,141638,0.93,0
The LA Rams have an assistant coach whose job is to make sure Head Coach Sean McVay doesn't run into the officials,aif0h8,TooShiftyForYou,108034,0.92,3
A Pelicans fan snuck on to the court for warmups stretched and put up a shot before the police escorted him off,7ttqeu,JF_112,103445,0.93,0
"""Just stay in there you're done for tonight""",80xq68,woody313,101412,0.94,0
The Monterrey Stadium. Mexico.,6vqj3t,berdyeff,99313,0.94,0
Dwyane Wade was very pleased with this no-look pass from LeBron,7rj9mv,TooShiftyForYou,97081,0.91,0
Synced videos of the Eagles fan running into the pillar,7sgrbd,sweedishfishoreo,97030,0.89,2
Boxing referee Steve Willis really loves his job,84r86t,suzukigun4life,96891,0.91,0
North Korean speed skater tries to trip Japanese opponent,7z0yxs,dickfromaccounting,93184,0.84,0
Celebration after $75000 half court shot,7caeqf,attheisstt,92240,0.89,0
amazing technique for this France goal,8v2j96,DavidBHAFC,92249,0.92,0
Yankees players hold a mock press conference after a home run,731bax,TooShiftyForYou,92142,0.91,1
Lebron James gives a behind the back pass to himself through his teammate’s legs.,81aysv,amont3s,92000,0.9,0
Fan throws John Cena’s shirt back to him,8cfe97,dickfromaccounting,91031,0.91,0
Friend who lost his leg to cancer got creative for Halloween,79hgf8,easycheesay,90497,0.84,0
Fallon Sherrock just became the first woman to beat a man at the World Darts Championship,ec3d3l,unknown_human,89744,0.85,4
Concession prices at the Atlanta Falcons' new stadium,6mpaxx,chrisman1831,88202,0.93,0
Watching the World Cup penalty shootout between England and Colombia without disturbing anybody is about as polite and English as it gets,8wdc7r,t94afc,88046,0.9,1
Buffalo Bills take the field in blizzard conditions,7ivi21,TooShiftyForYou,85629,0.9,0
Principal drained a full-court shot with the entire student body watching,99sqtb,gangbangkang,85562,0.88,0
France may have won the world cup but Croatia won our hearts. Congratulations to the silver!,8z31w0,BMI30,84621,0.72,1
Some golfers are braver than others,7kffx2,TooShiftyForYou,84522,0.92,0
Even Wimbledon players are mocking Neymar,8yt5in,PM_me_your_pee_video,84425,0.94,0
Don’t be like Nikola Kalinic,8yeqoc,Emergency_awesome,84377,0.91,0
Little kid outplays Rodger Federer with a perfect lob shot,9v3ae8,Scaulbylausis,82622,0.93,0
Harden hit himself in the face,dnn0v3,machiatzurelius,82375,0.95,7
Mexican fans went to the Korean embassy and made the ambassador come out and drink tequila,8udhwb,,80931,0.93,1
Marner of the Toronto Maple Leafs makes a girl’s Valentine’s Day,ar2poa,dickfromaccounting,80020,0.89,4
Sister Mary Jo blesses the first pitch in style,98gz9k,Scaulbylausis,79150,0.89,0
The fastest 100m times ever. Names crossed over were using doping.,6ryan4,mthrs,78916,0.89,0
This is why the World Series was so big to Houston,7agbai,Outsidecitylimits,78808,0.84,1
Lightning Goaltender Andrei Vasilevskiy looks between his opponent's legs to locate puck and make behind the back glove save,7wr3nv,TooShiftyForYou,78669,0.95,0
Toyota robot drains shot from the logo at a Japanese B-League game,bc3c8n,skatenula,78632,0.95,0
Larry Nance Jr. recreates his father's dunk from 1984,7ycox8,TooShiftyForYou,77687,0.92,0
"""Think you might need this back""",6wiupk,Ghost_Animator,76854,0.9,0
Aaron Feis an assistant football coach at Marjory Stoneman Douglas High School died a hero yesterday as he saved countless students by shielding them from the shooter.,7xrgyt,gangbangkang,76634,0.93,0
Good Sportsmanship,65q3lx,BunyipPouch,76298,0.91,0
Red Sox fan gives a foul ball to a young Yankees fan,9e5ea1,TooShiftyForYou,76031,0.89,0
Mascot Protects Kid From Foul Ball,66j4h9,TooShiftyForYou,75196,0.93,0
Kid nails impression,7f9hlo,TSW22,75178,0.87,0
Good Sportsmanship,80di5z,SuperKozz,74836,0.94,1
Cleveland Browns fans hold parade after historic 0-16 season,7olmp5,TooShiftyForYou,74511,0.9,0
I caught a ball.,944hid,commoninternetuser,74233,0.94,1
Oakland A’s player holds back tears as he is given standing ovation when stepping up to bat for the first time since his mother passed away at age 55 from Lou Gehrig’s disease,8i77er,dickfromaccounting,74152,0.9,1
Coach’s son started crying when he realized the seniors won’t be back,aw63h3,GoldenKushGod,74059,0.85,8
The Vikings score on a last second touchdown to advance to the NFC Championship,7qg5s2,homefree122,73694,0.79,2
Atleast the Dallas Stars did Spongebob right,an2qvp,chiefsassy,73556,0.85,10
NFL punter Jon Ryan had a special message for his Kicker when he left for another team,7n1zvn,SeattleMana,73244,0.91,0
Kickflip late back foot impossible by William Pilz,anu106,iam_nobody,72987,0.9,1
LeBron acknowledges the fans in the upper deck,akofua,TooShiftyForYou,72797,0.88,0
Team pulls off a beautiful goal despite terrible pitch conditions,6o111b,Ayy_2_Brute,72374,0.9,0
Ronaldinho gets the wrong card,7n9eu4,unknown_human,72276,0.9,0
Sisters at the Phillies game,81g5s8,dickfromaccounting,71947,0.85,0
Gareth Southgate consoling the Columbian player that missed a penalty 22 years after it happened to him.,8w2zd6,ManCrisp,71286,0.89,0
World Cup ending injury for Portugals Pepe,8sk7ag,butcheries,70955,0.91,0
Watching people return this dropped hat at the Houston Astros parade was unreasonably thrilling,7arr2o,GuacamoleFanatic,70188,0.86,0
Boxing's biggest star Canelo dodging punches like a super human,dz58pp,Glorusion,70146,0.93,3
"Ryan ""Sticky Hands"" Griffin Touchdown Celebration",e3fwel,Kbkool,69870,0.93,1
Red card anyone?,7pfvwm,Jamtonisalon,69445,0.87,0
A fan for life.,926z5p,SuperPixel,69367,0.84,0
Pump track,7fofoh,dickfromaccounting,69205,0.91,0
"""That"" selfie",9rdxen,Dangerpala,69181,0.83,0
25 years from the most memorable Olympic Cauldron lighting - Barcelona '92,6pf2xm,varito18,68850,0.93,0
Iranian girl cheers for her favourite football team from behind the fence as Iranian women aren't allowed into stadiums,c9hqun,Cyrus-V,68729,0.9,4
Playing football in bird's eyes view with VR glasses,8gqxxu,bearbeclawin,68076,0.91,0
Byron Buxton circles the bases in under 14 seconds for an inside-the-park home run,6uq3gl,JF_112,68030,0.91,0
Feeling a rookies's heartbeat before his debut,9qqm8r,LeonardoDiFapio,68008,0.88,0
Steve-O Now 10 Years Sober Just Crushed His First Triathlon,9jnxvt,zaybeth,67792,0.91,1
Why it's hard for DBs to cover Gronk in one unintentionally illustrative gif,7rcmfv,TheSumOfAllFeels,67657,0.89,0
Standard Russian penalty shot,6p1i23,,67638,0.89,0
Chloe Kim land back-to-back 1080s for the first time in Olympic history to win Gold in the Women's Halfpipe with a 98.25,7x68xs,caindaddy,67563,0.88,0
Foot sweep and knee,7cyb0c,unknown_human,67040,0.89,0
Fan wearing a Gilbert jersey gets surprised by Rod Gilbert,7p0qol,qwerty-confirmed,66777,0.93,0
Germany‘s last minute goal against Sweden,8tclzj,Pete2000,66430,0.86,0
"The Japanese Sport of ""Boutaoshi"" meaning ""Bring the pole down""",5iwpml,isaynonowords,66366,0.91,0
Phoenix Suns start to run down the court in perfect sync,77eqqb,Tipex,66258,0.88,0
"After His Critique of His Teammates' ""Lack of Urgency"" LeBron James's Defensive Efforts or Lack Thereof Against the Grizzlies were Spotlighted by NBA Media",avgf7h,Yu-Yu-Hakusho-is-Lit,66049,0.86,1
Jose Guillen redeems a botched catch with one of the greatest throws in baseball history.,cgvj84,rusy,65931,0.96,2
Just relax,854ft2,Botatitsbest,65839,0.9,0
Devastating knockout,7l11xm,unknown_human,65664,0.89,0
the most wholesome moment in tennis...,ch5yxd,am_rood_go_away,65652,0.93,4
Brandin Cooks of the LA Rams presents the team's custodian with Super Bowl tickets so he can take his son to the game,allhmq,TooShiftyForYou,65641,0.88,0
The best part of the Superbowl,5sf70n,GallowBoob,65628,0.83,0
Controversial No Call on a Potential Pass Interference in the NFC Championship Game,ai3ltc,Yu-Yu-Hakusho-is-Lit,65524,0.87,9
College game that got canceled due to lightning was settled the old-fashioned way,7iax90,dickfromaccounting,65417,0.89,0
26 years ago today Shaq tore down the entire backboard as a rookie.,bgibsw,Jobobo21_,65379,0.95,1
Lebron James pump fake and assist,841cfp,Whoshabooboo,65155,0.88,0
Atlanta Hawks fan hits half-court shot to win $10000,7jxacd,TooShiftyForYou,64623,0.91,0
Michael Jordan's pre-game tradition,6gcx81,Whoshabooboo,64594,0.92,0
Amazing Soccer Pitch in Lofoten Islands Norway,68baf5,jromeit,64131,0.92,0
The Cleveland Browns have won their first game since December 24th 2016,9hltmg,56haloodst,64110,0.88,1
Shaq learned an MMA move and immediately tried to sneak attack Charles Barkley,az5jtp,TooShiftyForYou,63985,0.91,0
What 10000 horsepower does to a drag tire at launch,agyaa0,Whitlow14,63710,0.92,1
Messi celebrating with Dembele after his goal today looks eerily similar to this iconic shot of Pelé.,aty5b1,wrdb2007,63564,0.84,1
Pittsburgh Steelers linebacker Ryan Shazier continues to progress in his rehab one year after suffering a spinal contusion that left him paralyzed on the field,a3t6j4,TooShiftyForYou,63386,0.9,2
"""You can't watch March madness in class""",5zz16t,mem12791,63028,0.88,1
The Cincinnati Bearcats Baseball team has mastered the art of the post game interview troll,82hjrv,Team_Muff_N_Stuff,62937,0.89,0
High School running back hurdles two defenders,a8mp65,TooShiftyForYou,62784,0.92,0
Getting on the green with style,8986rt,bsurfn2day,62579,0.94,0
When you can't qualify for the finals anymore and decide screw it,68estm,loda970,62513,0.93,0
Tiger Woods Masters win as a flipbook animation,bfe8yj,theflippist,62474,0.87,19
Swedish captain asking how Germany’s game went,8uj9jk,dickfromaccounting,62088,0.89,0
Lakers bench goes wild after Rookie Moe Wagner scores his first NBA points,a2t55j,commonvanilla,61912,0.89,1
Sportsmanship,5w7feq,GROUND45,61889,0.9,1
My dad's latest painting. Congrats Tiger.,bh0569,JonathanSafa,61702,0.88,8
Lacrosse Goalie Scores,6lee76,TooShiftyForYou,61575,0.92,0
Partially blind fan offers official his cane,6fd8sj,HMSInvincible,61114,0.9,1
Perfect tennis slice,82tv45,dickfromaccounting,61074,0.86,0
Failed Attempt by a Security Guard to Stop a Fan During an Atlanta Braves Live Post-Game Show Yesterday,97jkm2,BunyipPouch,61067,0.92,1
Man Discovers Hockey for the first time,a6823h,Smorespoppin,61041,0.88,2
Kurtis Downs lands an amazing trick at the Nitro World Games,86xmbk,dickfromaccounting,60967,0.91,0
Scoring and celebrating in the same motion,94a5lz,FriendlyBurglar,60318,0.91,0
Jacksonville State's Norbertas Giga who came to the US from Lithuania to pursue a basketball career sees his mom for the first time in 5 years,817elz,TooShiftyForYou,60315,0.91,0
Classy move by Dodgers to take full page ad in Houston Chronicle commemorative section celebrating first Astros World Series championship.,7ayo4f,GuacamoleFanatic,60295,0.87,0
Hockey Training for 9 Year Olds in Russia,7qpdd4,lessons_learnt,60125,0.92,0
Tiger Woods Wins 5th Masters Title; First Major Victory Since 2008,bd5ssl,yesh222,60120,0.9,6
Simone Biles' ceremonial first pitch for game 2 of the World Series.,dm8xcd,handlit33,60078,0.89,1
Milwaukee Bucks center Giannis Antetokounmpo gives his shoes to a young fan who gets emotional as a result. After the fan stops tearing up Giannis brings her onto the court and takes a picture with her,eemgvm,suzukigun4life,60008,0.91,4
Rugby player relocates shoulder mid play,au5ocd,Neyo708,60005,0.92,0
Now these are Cav's fans,6fqk6m,iBleeedorange,59898,0.82,0
Girl shows her artwork to her favorite player Giannis Antetokounmpo,b70aci,-criesuncontrollably,59887,0.92,2
Fierljeppen is Holland’s oldest sport,aj0wss,dickfromaccounting,59878,0.91,0
Competitive Tag,6o8uxg,TooShiftyForYou,59747,0.81,0
I coach youth sports. This 9 year old gets it.,7dfaxk,iamclarkgriswold,59698,0.86,0
Roger Federer winner of the most male Grand Slam singles titles in tennis history got ID checked going into the locker room at the Australian Open,ahncnk,TooShiftyForYou,59369,0.91,1
Easy to forget how big NBA players are. The Rock is 6'5 265 pounds.,aag4ke,lionking419,59333,0.9,0
"The Washington Capitals are having their Stanley Cup parade today but they also took out a full page ad in the Las Vegas Review-Journal to congratulate the Vegas Golden Knights ""on the most successful inaugural season in the history of professional sports.""",8qntul,dickfromaccounting,59031,0.87,0
"Coke's slogan is ""Share Happiness"". So I made an ad to remind them of the kind of happiness they're sharing in Qatar.",36voua,,58863,0.85,3
NFL kicker Graham Gano played kickball with his kids,8qs4kf,gangbangkang,58575,0.89,0
Pittsburgh Steelers tribute to the victims of yesterday's synagogue shooting,9s377y,gangbangkang,58552,0.87,3
He's cooler than the other side of the pillow...,9fpwgu,Pirate_Redbeard,58528,0.92,0
A close call at 1st base,7gmjj1,ironchefchopchop,58475,0.92,0
Exit Sign leaving Angel Stadium.,89rb4u,Da1isjess,58391,0.93,0
Dwyane Wade sought out Hawks rookie Kevin Huerter to exchange jerseys as Huerter grew up idolizing Wade and wears number 3 because of him,axmax4,TooShiftyForYou,58355,0.89,3
Andrea Iannone headbutts seagull at MotoGP Australia,9exvr3,PHIL-yes-PLZ,58250,0.88,0
Some guys built their own stands at the Little League World Series,98u75b,gangbangkang,57953,0.91,0
Alex Ovechkin was holding the Stanley Cup up in the middle of the inning at the Nationals game yesterday. They didn’t put him on the Jumbotron because the ball was still in play.,8q11ca,gangbangkang,57931,0.78,0
The Giants punt coverage manages to keep the ball out of the endzone to avoid a touchback,a2h8ml,TooShiftyForYou,57884,0.91,1
Surya Bonaly performs her signature move a backflip landed on one skate after losing her shot at a medal in the '98 Nagano Olympics. The move is illegal in figure skating due to its danger.,6i93pp,jackalooz,57681,0.91,0
Speed difference between GT and F1 cars.,93x0yr,Shady4555,57595,0.9,0
"LeBron gives his wristband to a young fan holding ""You are more than an athlete"" sign",84dsk3,TooShiftyForYou,57558,0.88,0
The most important stat...,6q3m81,,57439,0.9,0
Jets ask little boy who recently beat cancer to stop by for practice...and he scored!,95b76h,Plebsplease,57364,0.87,0
Tyreek Hill's high school 200m time vs. the fastest runners in the world,9y8tts,TooShiftyForYou,57314,0.89,0
Tony Hawk lands the first ever 900,alb763,BloviateBetting,57279,0.93,0
Phil Mickelson's trickshot over a man,8zoqa6,Cypher760,57092,0.91,0
Nike’s 30th anniversary of the Just Do It campaign,9cor8s,teeseoncoast,57025,0.64,2
A fan's phone falls and others send it back to him,awp081,dl2j,56932,0.92,0
"""Foooooooorce!""",69ttrm,iBleeedorange,56876,0.8,0
"Hafthor Bjornsson ""The Mountain"" sets dead lift world record",82xjal,Pirate_Redbeard,56682,0.93,0
Pittsburgh Steelers' Ryan Shazier who suffered a serious spinal injury in December walks on stage to announce team's 1st round draft pick,8f8w0o,TooShiftyForYou,56599,0.89,0
2nd & 3rd place winners of World Figure Skating Championships help to lift the champion for podium photo,dvubll,,56512,0.94,0
Enjoying Some Ice Cream At The Ballpark,6ku3vp,TooShiftyForYou,56380,0.85,0
LeBron James pressured Adam Silver to punish Rockets GM Daryl Morey for controversial tweet,djfmoa,Prometheus1889,56223,0.92,4
Batter hits baseball back into pitching machine,6m7xf0,NightTrainDan,56120,0.87,0
Old Teammates Jonas Jerebko and Donovan Mitchell Showing Some Mutual Respect,9pwj8s,Meatprint,55951,0.92,0
Boise State has a dog who retrieves the tee after Kickoffs,70qqtu,TragicDonut,55897,0.89,0
He died in 2015 Cancer...,8rc78c,Diamond_RKR,55826,0.88,1
In an empty stadium which normally holds 99000+ FC Barcelona plays behind closed doors as riots and protests continue in the city,73mho7,Dann610,55795,0.9,0
Soccer player gets bamboozled by little kid during pre-match walk out,7imh8d,missisipear,55745,0.85,0
German supermarket has a genius in charge of beer promotions,7cf86u,Architect81,55517,0.88,0
Draymond Green Jr. spots a picture of his dad,a9be2k,TooShiftyForYou,55484,0.89,0
Australian Cyclist Mark Renshaw’s son giving him a bottle at the last feed stop of his professional cycling career,dcacpa,caindaddy,55306,0.93,1
Fan let baseball player borrow his sunglasses and was rewarded afterwards with a game ball,8n5p6n,SeattleMana,55309,0.93,1
36-Year-Old Accountant Called In As Emergency NHL Goalie — And He Crushed It,88in8c,drsjsmith,55303,0.92,0
For us to be Successful we go through difficult things or challenges,84lefk,armzino,55221,0.9,1
Pirates fan gives his foul ball to a little girl nearby,9jyg5l,dickfromaccounting,55100,0.89,0
Baseball fan army crawls back to seat so as to not obstruct the view of his fellow humans,8335mp,SeattleMana,55067,0.91,0
Dirk Nowitzki crying after being introduced in his last NBA game.,bbukg5,,54996,0.92,5
Goalkeeper Training,94tgon,BunyipPouch,54956,0.88,0
Clemson Head Coach Dabo Swinney gives the team's equipment manager tickets to the Super Bowl so he can go with his dad,amfqcr,TooShiftyForYou,54700,0.83,4
2018 World’s strongest man,9cjoyy,iam_nobody,54655,0.94,0
A fan gave Cam Newton a big box of Bojangles fried chicken,92ep6t,gangbangkang,54649,0.88,0
Curling 360 no scope,7x00qk,Petaaa,54599,0.93,0
Arizona Diamondbacks have a young blind man throw out the first pitch of a playoff game,at9dz0,dickfromaccounting,54501,0.84,2
This little guy at the Reds game wouldn’t throw out the first pitch until he was on the mound,8t994k,dickfromaccounting,54476,0.9,0
Marcelo Vieira's 8 yr old son practicing headers with his dad's team Real Madrid,8jxzo9,louster9,54345,0.9,0
Afghan kid meets his hero! And doesn't want to leave his side.,5idu96,iBleeedorange,54174,0.88,0
Johnny Weir and Tara Lipinski look like they’re announcers for Hunger Games,7wb2ol,easyluckyfree13,54165,0.87,0
Goal in Scott Sterling's style.,6dh0x3,Ghost_Animator,54110,0.92,0
Ref in the CFP National Championship dodges a bullet,adyekj,TooShiftyForYou,54077,0.92,0
Mascot gets way too close to the security guard,89yrbz,tomj98607,54048,0.82,0
Amazing snag at the St. Paul Saints game,90laei,dickfromaccounting,53966,0.93,0
Ryan Williams lands a 1080 front flip (world first),6xwbgq,leonardo717,53936,0.92,0
Women's Water Polo - Hungary - Japan,6nsma6,csiramokus,53887,0.91,0
Naomi Osaka is reportedly set to sign Adidas' biggest deal with a female athlete — and it could make her one of the highest-paid women in sports,9fauos,LuNqiu,53812,0.91,0
SHAQ on China: “They know and understand our values ... and one of our best values in America is free speech. We’re allowed to say what we want to say and we’re allowed to speak up on injustices and that’s just how it goes” “Daryl Morey was right”,dlsms7,ZWass777,53759,0.94,2
This is Beckham,8wrxgl,salmanahmad_10,53597,0.91,0
Paulinho Boracini scores a 3 pointer after a pass to himself on a free throw to win the game.,86cef4,leolecal,53562,0.92,0
Zlatan Ibrahimović dismantles defense,7muxpg,unknown_human,53556,0.87,0
Playing Catch during a rain delay,6ce7qv,Whoshabooboo,53435,0.91,0
James Harden no look blocks DeMar DeRozan,a20l02,conez420,53338,0.92,2
Matt Bosher just baptized Kenjon Barner,a8xek6,furtree,53166,0.9,3
Bald eagle at the Twins home opener lands on Mariners starting pitcher James Paxtons shoulder,8a34lf,SeattleMana,53090,0.93,0
How the hell do you jump out of a pool..,6dz5w5,lugxero,53048,0.9,0
Devontae Booker hurdles defender,7k02vz,TooShiftyForYou,53048,0.92,0
Wayne Rooney scores from his own half,7ghans,TooShiftyForYou,53000,0.9,0
Pittsburgh Fan Catches St. Louis Home Run Promptly Throws It In The River,6ndiev,TooShiftyForYou,52955,0.9,0
Dick Fosbury changes the High Jump forever with the Fosbury Flop at Mexico 1968 Olympics,73zhvp,TragicDonut,52878,0.94,0
Young fan gets a high-five from Steph Curry,80pqgp,TooShiftyForYou,52871,0.87,0
Professional Ultimate Frisbee,6udy6p,BunyipPouch,52808,0.85,0
Super intense tic-tac-toe game at the schoolyard,9bljjm,azgrunt,52789,0.86,0
World Cup: Belgium eliminates Brazil,8wn4zk,rchresta,52725,0.86,0
High Quality play in the Saudi Arabian League,9i1gir,wrdb2007,52666,0.91,0
Dad marking out on a small football pitch with his blind son's hands what's going on down on the actual pitch.,76xsjc,wrdb2007,52410,0.9,2
Iceland has just won a point in their first World Cup game ever!,8rk3k2,swisspower1997,52379,0.91,0
13 year old girl gets a hole in one after being promised she'd get a puppy if she did it,7znps9,phoenix160788,52367,0.87,0
Supermoto racer Arttu Stenberg showing off his skills,9tohh5,dickfromaccounting,52347,0.93,0
Shaquem Griffin a linebacker who only has one hand wasn't invited to the NFL combine and had to petition in order to participate in it runs a 4.38 40-yard dash. It's the fastest by a linebacker since the combine began being televised in 2003.,8203zm,suzukigun4life,52259,0.9,1
Northern Michigan seals the victory with the first goalie goal in program history,a4cgff,TooShiftyForYou,52254,0.92,1
Eagles celebrate touchdown with a home run,753gc0,TooShiftyForYou,52227,0.81,0
Colts invite girl who survived getting shot 7 times during a school shooting to break down their team huddle,93i5c9,TooShiftyForYou,52189,0.88,0
Special needs high school basketball player drains her first career shot,7v2g9r,TooShiftyForYou,52192,0.86,0
LeBron James throws it off the backboard to himself and slams it home.,8p66z4,iBleeedorange,52180,0.86,0
Freshman Blake Peters from Evanston High School (IL) attempts full-court game winner.,7tcqi8,runnerman8,52144,0.9,0
F1 pit stops in 1981 vs 2019,bs6z6j,iam_nobody,52119,0.94,1
Watching Tiger Woods tee off 2002 vs. 2018,967y3k,gangbangkang,52077,0.88,1
To honor fallen teammate Jordan McNair Maryland took the field with only 10 players leaving the guard position empty and took a delay of game penalty. Texas declined the penalty.,9c74t8,TooShiftyForYou,51981,0.75,0
Ichiro goes Full Ninja to score a run,8hfj96,SeattleMana,51921,0.89,0
The Korbut flip 1972,as39fl,_NITRISS_,51907,0.89,0
Soccer player Andres Iniesta played his last game with Barcelona after 20 years at the club. He stayed on the field until 1 a.m. after the game.,8llthy,gangbangkang,51837,0.93,0
Catch of the year...,7gzaww,T_Money22,51829,0.92,0
General Motors head of product development wrecks the pace car at Detroit Grand Prix,8obpop,TooShiftyForYou,51723,0.93,0
Tommy Fleetwood makes a rare albatross at Wentworth,av1en5,cyXie,51709,0.91,0
Insane body control by Angel Rice,7v7hh4,UnPunkMonk,51683,0.85,0
19 Year old Rookie Makes NHL Look Like a Beer League,57hmw4,abhinavwow,51580,0.9,0
Jeremy Evans dunks over a painting of himself dunking,6kzxf9,,51422,0.83,0
Kevin Durant gives his shoes to a young fan,7jbq8z,TooShiftyForYou,51282,0.85,0
Clippers Head Coach Doc Rivers called a timeout with 9.4 seconds left so that the Los Angeles crowd could give Dirk Nowitzki a standing ovation as part of his last game there,av5s2v,TooShiftyForYou,51171,0.94,1
The best part of the Superbowl,7q5a7b,schmidy21,51151,0.88,1
World Archery Youth championship,dzls78,aids_free_since_69,51157,0.88,0
Miles Taylor a 99-pound man with cerebral palsy accomplishes a 200-pound deadlift,aoitd6,suzukigun4life,51063,0.75,2
Arizona State's N'Keal Harry beats the entire defense to score a TD,9ccynu,TooShiftyForYou,51056,0.9,0
Travis Pastrana honors Evel Knievel by jumping 52 cars (143 feet) at Caesars Palace,8xd802,dickfromaccounting,51010,0.88,0
Belgium celebrating a goal,8umij2,ChrisPars,50922,0.91,0
Eric Young Jr back-peddles to home plate to avoid getting touched out,8oi15r,SeattleMana,50832,0.91,1
San Francisco's George Kittle falls down to get open,aciy8y,TooShiftyForYou,50787,0.92,0
Coach can barely keep it together due to his player’s realness. Sometimes you don’t know your impact on another until it hits you!,82c8fo,nomoreshiny,50768,0.89,3
Celtics Fan from my school,9ozzcp,PurpleRaptr,50721,0.77,0
Son Heung-Min with arguably the goal of the season.,e7gefk,Greatfool19000,50703,0.91,4
Bike football,7dzzxs,attheisstt,50632,0.89,0
This 2-point conversion should count for at least 4 points,75h5rd,GuacamoleFanatic,50549,0.86,0
Professional Tag Game at the World Chase Tag Championships,83vkf4,dickfromaccounting,50474,0.81,0
Brett Connoly wants to get a Puck to an young girl.,8cmfte,WarlockOPain77,50435,0.94,0
Goal keepers header in the 95th minute wins the game for his team,a5iseu,boi_thats_my_yeet,50328,0.92,2
Pittsburgh Steelers LB Ryan Shazier who suffered a spine injury 2 months ago stands up at Penguins game,7vtolt,TooShiftyForYou,50200,0.91,0
Oakland Raiders practice squad kicker Giorgio Tavecchio had been trying to make a team since 2012 finally got called up to play yesterday. He went 4-4 on field goals including two from 52 yards out and got the game ball.,6zh0xj,TooShiftyForYou,50148,0.9,0
"Hopkins lacrosse executes a perfect ""hidden ball trick"" to score against Navy.",5stnaz,the_8th_henry,49991,0.9,0
One could say UofA security isn’t the best,9mr3fb,azgrunt,49984,0.89,0
Getting in the opponents head,865yxs,homefree122,49943,0.86,0
Tony Romo calls every clutch play before they happen at the end of the AFC Championship,aibc1i,TooShiftyForYou,49655,0.89,2
This Rockets fan,8ji5sz,lolzsupbrah,49541,0.87,0
Eduardo Nunez hits an inside the park home run for the Red Sox in under 16 seconds,885znk,suzukigun4life,49482,0.9,0
Over 36 years ago today Luke Appling hit a homerun at 75-years-old during an Old-Timer Game,95fv5d,dickfromaccounting,49482,0.93,0
Every survivor of Larry Nassar's abuse standing on stage during the ESPYs,902cp4,holyfruits,49371,0.82,1
