Brilliant touch by the sky sports app for International Women’s Day,az29dg,,27452,0.74,0
Zlatan Ibrahimović has been calling LA Galaxy fans to congratulate them on buying season tickets,94ffh9,gangbangkang,27424,0.9,0
Miami and Duke played a football game on Slip 'N Slide field conditions,9u53jb,TooShiftyForYou,27415,0.94,0
101-year-old Indian woman wins 100 meter dash at World Masters Games in New Zealand as the only competitor in the 100+ age category.,67j406,bustaq,27368,0.9,0
"The ""Miami Miracle"" game winning play against the Patriots 8-bit Tecmo version",a54b1x,Whoshabooboo,27345,0.89,3
Young Houston Astros Fan Faked Out By Umpire,8rgvd0,BunyipPouch,27333,0.9,0
Don't mess with the Texans.,6wvnus,NightTrainDan,27297,0.74,0
Kid learning to dunk hammers it over his own dad,bu9xf7,edgyblackboi,27277,0.93,2
Tyler Nicholson and Staale Sandbech create a new Olympic Sport,7zgyc3,BigThiccCan,27221,0.93,0
Does this count as a 2 or a 3?,5rvacd,jesser722,27208,0.88,1
John McGinn's volley vs Sheffield Wednesday.,9i7ec9,vivlam,27190,0.94,0
"Exactly 20 years ago today ""The Bite Fight""",6k1w0o,StuffyUnicorn,27153,0.91,0
Heavy Metal Granny,709tzv,vik1980,27126,0.86,0
The tee retriever for New Mexico State works really hard,9akvej,gangbangkang,27110,0.92,0
High School heavyweight Gable Steveson celebrates his 4th Minnesota state wrestling championship with some amazing acrobatics for a 260 pound athlete,826z4u,thebigsexy1,27108,0.93,0
Finishing 3rd while carrying the camera rig is just showing off.,9wf31b,TheAstraeus,27084,0.88,0
Celebrating the right way,8fxzpf,Rohit49plus2,27086,0.87,0
"FIFA no longer considers ""corruption"" a violation under its new ethics code but will now ban any officials found to have made ""any public statements of a defamatory nature towards FIFA.""",9771ba,The_MartianManhunter,27077,0.96,0
Billy Hamilton reaches up and over the wall to stop a home run,8yrk1v,Icey_Legumes,27069,0.93,0
From Hero to Zero,7fhxtw,GooFy1104,27060,0.93,0
Drew Brees sent a custom gift to the Offensive Linemen who blocked for him as a thank you for helping him break the NFL passing record. Here’s OT Damion McIntosh’s.,a6rg61,SanduskysSecrets,27054,0.89,3
'What just happened?',7q1qyr,shakespearesreverse,26985,0.88,0
"2018 Worlds Strongest Man ""The Mountain"" vs Arm-wrestling Champion Devon Larratt",9twi5b,SeattleMana,26963,0.94,0
Dad's drawing of MJ from his art class in 1992,aqbaok,Sneijder4BallondOr,26919,0.9,2
Beauty and the Beast - Kovalchuk and Morozov Figure Skating for the KHL All Star game,5j2923,iBleeedorange,26921,0.88,0
Leicester City become Premier League champions,4hjqn8,syn69,26912,0.79,1
Jet Sprint Boat Racing,94zl5v,FairDinkemAussie,26884,0.92,0
2019 Indoor Skydiving World Championships,d6hwwg,caindaddy,26866,0.94,0
Jacob Faria somehow catches a 108 mph flying back to him,9izm76,NewFound_Fury,26858,0.94,0
Ostrich Racing in Minnesota it's as ridiculous as it sounds.,93dhcp,BunyipPouch,26827,0.79,0
Seahawks sideline coach with a spectacular hidden ball move,7a53f3,SeattleMana,26819,0.91,0
Francisco Cervelli reassures his pitcher Trevor Williams as he calls for a low curveball Williams executes perfectly,b85pr9,ColorblindCuber,26751,0.94,1
Kori Carter's 'Game-face',6t6zyl,deptford,26745,0.89,0
"4'8"" Olympic gymnast Simone Biles standing next to 7'1"" Shaq 😳",5sa72e,Danteezus,26717,0.88,0
Capers-Smith goes for an interception but the ball goes straight through his hands,6y0t13,JF_112,26714,0.9,0
Mexico fans throwing bottles at player taking corner. Trinidad shuts them up.,4vm2of,evyi,26713,0.88,0
Tony Romo narrates a cat taking the field during the Dolphins Ravens game,790sry,carlstones,26617,0.91,0
Skiing through the valley of death,6xe0r5,_Ryanite_,26610,0.93,0
What a sailboat going 50 knots looks like,cw93vp,Ayy_2_Brute,26541,0.92,0
Michael B Jordan target practice,e4h32s,aids_free_since_69,26455,0.87,0
Mayweather TKO of McGreggor in 10th round,6wae9t,FishSlapped1234,26444,0.75,0
Aaron Rodgers fucking hates The Eagles man.,58nfp6,Isai76,26443,0.83,0
Billy is a boy with the coolest home run celebration. (x-post /r/humansbeingbros),8k81yf,GenXStonerDad,26387,0.84,0
Novak Djokovic is classy AF,4xiiuc,Frankger15,26371,0.86,0
Houston Texans NFL Owner on Kneeling: ‘We Can’t Have the Inmates Running the Prison’,793w0l,number2240,26298,0.85,0
Douglas Costa gets past seven defenders to score the game winning goal for Juventus in the 93rd minute,dszyi9,Mcgoozen,26266,0.94,0
Japan score a brilliant team try against Scotland in the Rugby World Cup!,dh9lgu,_dictatorish_,26246,0.93,0
The respect these guys have for each other is amazing,5qxbsw,GerrardSlippedHahaha,26182,0.89,0
Muhammad Ali dodges 21 punches in 10 seconds.,78ihby,,26166,0.87,0
Toronto Blue Jays Infielder Darwin Barney has a really tough time getting to 3rd base,6znuru,BunyipPouch,26067,0.9,0
Powerlifter Jessica Buettner attempts a 237.5kg (523.6 lb) deadlift at the 2019 IPF Worlds,c12nrw,RespectMyAuthoriteh,26057,0.91,1
Spectator just past the halfway point of the Boston Marathon encouraging runners to not give up,8codux,TooShiftyForYou,26043,0.88,0
TJ Dillashaw uses Renan Barão’s head as a punching bag successfully defending his Bantamweight championship.,9optsg,Stonefree2011,26033,0.91,1
Fan High-Fives Chicago White Sox Right Fielder Avisail Garcia After Catch,6zts4o,BunyipPouch,26023,0.92,0
Patrick Warburton drops the puck and brings back David Puddy to pump up the New Jersey Devils crowd,asscjx,TooShiftyForYou,25891,0.91,0
Cal QB Ross Bowers somersaults into the end zone for a TD,76aei6,TooShiftyForYou,25879,0.91,0
This is a soccer/volleyball game called Sepak Takraw native to SE Asia,9ek2ot,azgrunt,25850,0.94,0
One of the most Irish Experiences I’ll ever have: Hurling lessons in a parking lot behind Waterford Crystal a couple guys preparing for the Regional Championships.,9ht4c9,_WhoisMrBilly_,25801,0.93,0
Arsenal finishes off a crafty team goal,9m6t77,TooShiftyForYou,25781,0.93,0
Washington Capitals' Devante Smith-Pelly Squirting Water at an Annoying Heckler,7y73pf,BunyipPouch,25737,0.92,0
Absolutely incredible skills to sink the basket during a high school basketball match,891yfk,BossCrackNi88aFresh,25690,0.85,0
Poster at SEC Gameday makes fun of Tim Tebow's attempted baseball career,6z2mhi,BunyipPouch,25686,0.83,0
Failed Soccer Bicycle Kick,718l10,BunyipPouch,25671,0.91,0
Steelers RB James Conner is a cancer survivor. He had a moment with a young fan that finished chemo.,9o6llf,gangbangkang,25643,0.93,0
The NHL's Twitter page made this college in honour of Jaromir Jagr,7u2ik3,JF_112,25553,0.86,0
Vasyl Lomachenko knocks down Chonlatarn Piriyapinyo with a sequence only he could throw,7hpwku,Tom_Cody,25532,0.89,0
Marcus Mariota delays the handoff until the very last moment before flipping the ball forward for the touchdown,9ulki6,TooShiftyForYou,25520,0.96,0
On this day 20 years ago the Monstars blew a 66-18 halftime lead to Michael Jordan and the Tune squad,5d6n6d,Buddwyer50,25487,0.86,0
"Seattle Seahawks' Michael Bennett calls out other pro athletes charging for youth camps: ""Whether it’s Steph Curry or whoever it is it makes me mad because there’s so many kids who can’t afford to pay such a high amount of money. How much money do you need before you start giving back for free?""",4rt82g,Jah-Eazy,25494,0.88,0
Unbelievable save by Steven Odendaal in Moto2,clid43,exemon,25473,0.94,1
Go Jags,6yy45n,flaglerite,25423,0.92,0
Mbappe Wasting Time Cheeky,8xsrg0,Ghulam_Jewel,25379,0.88,0
Michigan State senior cornerback Josh Butler brought his dogs Roxy and Remi into Spartan Stadium as he was introduced before the game against Maryland. Butler lost both parents during his college tenure and he chose to walk with his dogs on senior day.,e4lqxa,byniri_returns,25371,0.96,1
Can we get this guy some help? Groundskeeper works alone while 8 refs stand around and watch.,7h7oh5,Leafs9999,25362,0.86,0
Eric Murray Commits Highway Robbery on This Interception,9kmpva,CaramelPhD,25351,0.92,0
3 year old girl Arya Griffin drops 6ft halfpipe for the first time,ao3qli,theshittyskater,25343,0.87,1
Halftime at Super Bowl I,5ezr49,andrew6622,25319,0.83,0
Libor Hroza sets a new world record in speed climbing,9brlqy,thegreatsaiby,25317,0.92,0
Alshon Jeffery of the Philadelphia Eagles visited a class of 2nd graders who wrote him letters of support after his dropped pass in the playoffs,ah3oip,TooShiftyForYou,25286,0.93,0
Patience can be the key,5u7owd,TooShiftyForYou,25238,0.89,0
Tigers fan looks like Justin Verlander more than Justin Verlander does,6ako6z,I_am_bot_beep_boop,25152,0.87,0
Umpire makes a nice catch,97z0f0,Scaulbylausis,25138,0.92,0
I'm watching the USC-Texas game and then I randomly see my brother in law on TV standing behind Matthew McConaughey with his camera pointed straight on him. A few minutes later I get this picture sent to me.,70lvfj,uscnick,25143,0.94,0
Shaun Livingston with the disgusting crossover past James Harden,8kxfi7,iBleeedorange,25108,0.9,0
Suliasi Vunivalu try (NRL) Storm v Rabbitohs,9dtx5h,ScarletLion1,25029,0.91,0
Brewers Martin Maldonado rips the cover off the ball,8fjmu5,SeattleMana,25019,0.93,0
Duke freshman Zion Williamson dunks from the free-throw line,97bofi,TooShiftyForYou,25008,0.93,0
An emotional scene tonight in Winnipeg as the Jets and the Blackhawks all play with “Broncos” on their jerseys in support of the horrific crash that claimed the lives of 15 members of the Humboldt Broncos junior hockey team,8am08u,dobrich91,24964,0.95,0
Preview of this year’s Crankworx mountain bike slope style course in Whistler B.C.,crq4ea,RampChurch,24936,0.96,1
Paraglider scores a perfect landing,6wqjh2,_Ryanite_,24927,0.92,0
Hide and go seek!,782zu6,TheTreelo,24917,0.83,0
[Graphic] Gordon Hayward breaks his ankles on opening night,772vcs,raytardlee,24894,0.81,0
USA Gymnastics says all directors have resigned after abuse scandal,7ub6qc,pipsdontsqueak,24846,0.94,0
P.K. Subban scores from mid-ice,7jpi4p,TooShiftyForYou,24812,0.9,0
The moment Bruno Hortelano learns he won the gold medal not silver (200 meter European Championships),4rx2he,Rc87,24811,0.9,0
Antoine Griezmann and Hugo Lloris in 2014 vs 2018,8x19ei,kartiksoni2209,24798,0.92,0
A black cat invaded the Cowboys/Giants Monday Night Football game,drsln6,suzukigun4life,24748,0.92,2
Om Yun Chol triple body weight (166kg@55kg) clean & jerk at the 2019 Weightlifting World Championship.,d5y1gr,cjsanx2,24742,0.95,2
Posted on NFL's Facebook page,7r16rg,Zkbvjxq,24735,0.85,0
Fan at San Francisco Giants vs Arizona Diamondbacks game kept switching jerseys to get free souvenir balls from each team.,8oww16,BunyipPouch,24718,0.88,0
Steven Wrights no rotation knuckle-ball,8oxgo8,SeattleMana,24719,0.95,0
A strangely-timed football game photo,513vj7,bkshahi,24691,0.89,0
Some would say this is the perfect motorcycle turn...,6j9nem,billbasketball,24623,0.8,0
South Korea win the 2018 Asian Games. Their players no longer have to serve mandatory 2 years in the military service.,9c3evl,LFC_Joe26,24628,0.92,0
Incredible handball penalty,5xpqo3,kappla52,24603,0.88,0
[NRL] Chip chase flick pass try!,870h6x,ScaredOfGreatness,24575,0.93,0
10 years ago: A 9-year-old named Katie Ledecky gets an autograph from Michael Phelps. They both won gold medals today,4wzvp5,MaoMeowed,24553,0.91,0
Geraint Thomas has become the first Welsh cyclist to win the Tour de France,92wbwl,Sebassyion,24517,0.92,0
He followed through.,5lvshv,ohhsuzyq,24505,0.93,0
Tennis Champion Naomi Osaka's $8.5M Adidas Deal Biggest Ever for a Woman,9h1v1m,tellman1257,24499,0.91,0
Joe Mixon accidentally takes out a referee with his helmet while celebrating,ehlq8w,Fear_Jaire,24471,0.96,0
Floyd Mayweather-Conor McGregor fight finalized for Aug. 26,6hae60,ILoveLamp9,24449,0.84,0
7-Punch Combo.,6chf1b,,24388,0.89,0
Movlid Khaybulaev's flying knee-kick completely obliterates Damon Jackson during early part of MMA fight.,bshf27,BunyipPouch,24387,0.93,0
Shaq attack,74ezif,unknown_human,24372,0.92,0
USA fan heckles Rory for missing putt gets challenged to make it himself and drains it.,553ial,jbomb6,24365,0.87,0
Tiger Woods' Return to the Cover of Sports Illustrated,bfjfsx,BunyipPouch,24367,0.93,0
That CFL limbo celebration destroys everything I've seen so far in the NFL this year.,7chtag,GuacamoleFanatic,24361,0.9,0
Chicago Cubs & Arizona Diamondbacks during a rain delay,7mj99t,BunyipPouch,24311,0.91,0
Incredible picture from NJ/PIT game,6426nk,PM_ME_AWESOME_TITS,24242,0.93,0
French rugby player who knocked referee unconscious receives life ban still faces civil lawsuit from referee he attacked.,69gfhg,senor_limones,24234,0.91,0
#REFLIFE,5ggw5c,Sullydotcom,24228,0.89,0
A ball boy sneaked into the Portugal team photo tonight in their game against Wales,4rkm3v,CaptainFiddler,24215,0.87,0
49ers' Katie Sowers to make history as first female and openly gay person to coach at Super Bowl,eroqwh,Area_man_claims,24113,0.76,2
JaVale McGee who won a championship with the Warriors last year but now plays for the Lakers finally got his championship ring when the two teams played on Saturday,amskdu,TooShiftyForYou,24111,0.92,1
Steven Adams throws a perfect full court inbounds pass with 1.1 on the clock to Schröder to tie the game,e79nqw,CaramelPhD,24056,0.95,0
First Russian UFC champ during a ceromy honouring him,9qcg60,William-biggi,24017,0.87,0
Australian cricket fans create one of the greatest beer snakes ever seen,7ff0r8,SundayRed,24012,0.92,0
At Fenway park on June 9th 1946 Ted Williams hit a home run that landed 37 rows up in the right field bleachers 502 feet away from home plate. The Red Sox marked where it landed with a red seat.,d91k3e,BunyipPouch,24018,0.95,1
Nashville's Pekka Rinne stick handle save,8gzmct,TooShiftyForYou,24010,0.94,0
Northern Kentucky basketball runs a football play to get a critical late game inbound pass,afagdj,TooShiftyForYou,24011,0.92,0
Stephen Curry. The Last Splash Brother.,c0kvgz,BowlPotato,24000,0.91,0
Smooth Ping Pong Back Shot,5uk9l6,Kohano,23921,0.9,0
The pass of the World Cup (James Rodriguez),8tkahp,Pete2000,23914,0.94,0
Russian boxer Ruslan Provodnikov's Urine sample after a 12-Round Fight,74khi6,vik1980,23870,0.88,0
How the Iceland football team was selected,4qb0gf,xMeta4x,23873,0.83,0
Cleveland Browns fans holding a public tryout for a new Kicker,9gnnlb,TooShiftyForYou,23843,0.94,0
Mariners Closer Tom Whilhelmsen has no idea he completes combined no-hitter after getting last out,8iokwn,SeattleMana,23836,0.91,0
Throttle Control and Balance,5texdw,Rockwell608,23817,0.88,0
playing tennis with a fireball,5jufh6,Nezaus,23799,0.91,0
Damian Lillard of the Portland Trail Blazers entered the arena tonight as Stone Cold Steve Austin,9qkxny,TooShiftyForYou,23785,0.93,0
Awesome One Handed Catcher,691huz,Dzg2115,23766,0.88,0
One handed catch by Justyn Ross,adqey4,Kyoya23,23736,0.9,2
I'm not a hock fan but that's slick,ax70fh,MrBluuBeriiMuffins,23719,0.85,0
Don Frye and Yoshihiro Takayama shows what a real fight is.,6r4vmc,,23689,0.9,0
That is one quick pitstop,4od9zs,Percysshn,23633,0.89,0
We playing football not .. balls balls,5ld4fr,YamiiYugii,23606,0.88,0
Travis Rice getting caught in an avalanche (he survived),7wobz6,lessons_learnt,23607,0.95,0
The body of an elite baseball player,5ltnf3,soccerperson,23549,0.84,0
School Science teacher dunks for his students,aqj0di,supahbest,23534,0.92,0
Khabib jumps into crowd to fight McGregors team after winning by submission.,9m2vhr,Griffdogg123,23512,0.91,0
ESPN is such a joke.,5vrvdl,RadioactiveWalrus,23483,0.8,0
On this date 52 years ago,6dd3sm,lmeowster,23429,0.89,0
51 years old Dennis McCoy landed a 900 at the X Games last night,90gub6,caindaddy,23412,0.94,0
How to properly block a Field Goal,5i1cop,-___-___-__-___-___-,23389,0.88,0
When you want to watch the game but your sister is in the Spelling Bee Finals....,6euvkc,SuperJezus,23386,0.86,0
The Cleveland Browns have won their first game of the season,5k55f8,boxesoftacos,23340,0.86,0
Kentucky cheerleader flips down the length of the basketball court,avs6uq,TooShiftyForYou,23320,0.93,0
Conor McGregor facing Cristiano Ronaldo,71q03t,unknown_human,23287,0.82,0
Waitin' for the Bills to make the playoffs,7j0o6w,Pirate_Redbeard,23289,0.95,0
Monarch Butterflies invade Toronto baseball game,d46na3,Reacher-Said-Nothing,23280,0.95,0
Never celebrate too early,4wa918,3yronF1ve,23273,0.86,0
This mixed-reality at the Ravens game.,ea0bun,TheRookieGetsACookie,23235,0.92,1
The selections that are still alive,8torbb,Arkadix44,23201,0.93,0
How to keep a runner from going 1st to 3rd,4k86aw,Youngkim41,23183,0.9,0
Zlatan Ibrahimović scores his 500th career goal.,9g6nkn,GrapeJuicee,23153,0.94,0
Mario Hezonja blocks LBJ to take the W for the Knicks,b29240,NewFound_Fury,23138,0.93,1
One of the greatest sports fights of all time occured on Feb 27 1998 between the ECHL Louisiana Icegators and Tallahassee Tigersharks. Someone only recently uploaded the footage. It is INSANITY,7a2pk6,LiquorNoChase,23025,0.9,0
"In August Arkansas State head football coach Blake Anderson lost his wife to breast cancer. Today was his first game back after taking a short leave of absence and his team faced the University of Georgia on the road. In honor of his wife Georgia fans organized a ""pink-out"" in their home stadium",d4h5f9,suzukigun4life,22977,0.95,1
Protest in Hong Kong immediately after Lebron's statement,di8fwt,pizza_and_cats,22939,0.96,0
Presenter draws a penis on live TV while commentating on a Hockey match,605ecm,iBleeedorange,22916,0.86,0
Kyle Baldock's POV BMX Run at the X-Games,90psw9,BunyipPouch,22891,0.92,0
Connor McGregor vs The Mountain (sparring showdown),6flj97,PR3DA7oR,22879,0.9,0
UFC fighter makes a special needs fan dream come true,ancgyu,BloviateBetting,22875,0.91,1
Bartolo Colon showing his agility.,6ptm02,Whoshabooboo,22850,0.91,0
The Cleveland Cavaliers Playoffs Stats....,6g8wyf,TBD1710,22833,0.88,0
Home Runs Can Be Dangerous,5zk9k7,TooShiftyForYou,22827,0.91,0
Browns defensive lineman rips Steelers QB Mason Rudolph's helmet off and hits him in the head with it,dwlq3l,suzukigun4life,22803,0.92,1
Floyd Mayweather's only KO in 10 years against Victor Ortiz,6ie363,,22746,0.85,0
Utah makes a comeback from losing by 23 points at half time to beating UCLA with a buzzer-beating 3,ap6r0s,Zander_Bagels,22726,0.92,0
Brazilian striker Matheus Cunha scores an absolutely ridiculous goal for RB Leipzig,ba8c2q,CornerKickAficionado,22672,0.95,0
The Tampa Bay Lightning social media team won twitter today.,5nozy1,henry_the_cat,22638,0.85,0
Goalie’s pad strap stops hockey puck from going into the net.,abdasx,BradyH4,22612,0.95,0
Iceland beats England 2-1 will play against France in quarter finals.,4q5lun,marcelgs,22549,0.83,0
Chance the Rapper plays a hockey reporter who knows nothing about hockey,7e5qi4,uncheel3,22513,0.86,0
Good show of sportsmanship from Ronaldo,8v4d2y,TooShiftyForYou,22507,0.82,0
May not be a big deal to anyone else but my team won our first mens softball tournament together and i got the MVP of the tournament last night for the first time. 5 years of lots of hard work finally paid off. Sports amaze me every day by teaching me hard work and dedication do pay off.,6ojfca,Cucumber68,22445,0.72,1
The look of pure joy after scoring a goal,8o5zva,Trento322,22437,0.9,0
Oklahoma City Thunder's Steven Adams gives up a chance to score to prevent fellow colleague Denver Nugget's Mason Plumlee from getting hurt,a6e1na,valemanya08,22408,0.95,1
Austin Jackson taking outfielding next level.,6r0t5g,GuacamoleFanatic,22400,0.93,0
A little jewel by Racing Club's Lautaro Martínez,85j5y8,Ynwe,22398,0.93,0
What is this sport called?! This is really fascinating.,ayfm9x,feeblefiasco2,22338,0.92,0
Rams Punter Johnny Hekker played QB in high school and is a master of the fake kick,aisqdp,TooShiftyForYou,22328,0.93,0
Confusing your opponents,5prk1p,I_am_bot_beep_boop,22319,0.89,0
Witkowski vs. Seeler Hockey Fight,826ihm,TooShiftyForYou,22310,0.89,0
Brazil's Maya Gabeira sets world record for the largest wave surfed by a woman 68 feet,9l2871,caindaddy,22305,0.9,0
Kenley Jansen's no look catch & double play off a broken bat.,9b62pw,shaka_sulu,22269,0.96,0
"The Seattle Seahawks receivers do the New Edition ""If it Isn't Love"" dance after a touchdown",e5azsj,suzukigun4life,22252,0.86,0
"Controversial Premature Ending to Diaz-Masvidal's ""BMF"" Main Event",dqw0i0,Yu-Yu-Hakusho-is-Lit,22223,0.92,2
Joe Rogan: keeping things simple,5okj5u,HotWine,22230,0.86,0
Seven-year old Rudolph “Blaze” Ingram from Tampa Bay runs a 60-meter dash in 8.69 seconds and 100 meters in 13.48,apunem,effectivepep,22176,0.94,1
Georgia State Upsets the University of Tennessee with a Final Score of 38-30. GSU was paid 950000 USD to play in this game by Tennessee.,cy2blz,Cheelai-Is-Thick,22142,0.93,0
Caneball: Volleyball On Steroids,6glavl,throatfrog,22127,0.89,0
Sergio Garcia wins the 2017 Masters on the first hole of sudden death versus Justin Rose.,64g4vv,purepalmetto,22111,0.82,0
Johnston's foot race & tackle on Vunivalu [NRL],6cmmqi,ScaredOfGreatness,22073,0.92,0
Hockey player gets stick stuck in glass,65bvev,rschoeni,22066,0.91,0
Throw it back!,79lpti,FAX_ME_YOUR_BOTTOM,22053,0.92,0
Kawhi Leonard makes an amazing game winning buzzer beater shot to beat the Philadelphia 76ers and advance to the Eastern Conference Finals,bnwxso,homefree122,22048,0.9,2
Suspended high school football player donned a different number and name just so he could play in a game. A reporter discovered it and now the whole coaching staff has been fired and the team forfeits every game of the season.,dkji73,gillyhappy1,22011,0.96,0
Minor league baseball player hits grand slam ball smashes his own truck,4z0pl3,millitzer,21999,0.91,0
105.5 MPH throw from left field to get the out at the plate,4ftjs1,iBleeedorange,21983,0.87,0
High School WR picks up CB into the end zone,dhi4sd,kanggang47,21885,0.94,0
Final Out of the World Series; Astros win their first World Series in Franchise History!,7a93yi,Meatprint,21888,0.79,0
Limbo champione,6oy06a,nomosho,21850,0.85,0
Orlando Pride defender Carson Pickett meets a fan (x/post /r/mls),cg07xv,abesrevenge,21842,0.91,3
Fiji have won their first Olympic medal ever Gold in men's Rugby 7s. Here they are post-match.,4xatbk,WallopyJoe,21840,0.89,0
"Russell Martin stares down Angel Hernandez ""put your mask back on""",6qb5h9,GuacamoleFanatic,21839,0.86,0
Kevin Durant who was drafted by the Seattle SuperSonics before the team relocated wore a Sonics jersey and was loudly cheered in his return to the city,9lt54f,TooShiftyForYou,21840,0.89,0
ESPN to bring back ‘The Ocho’ for day of dodgeball chess boxing,93p71d,A_Piece_of_Pai,21820,0.92,0
